"IoT and Cybersecurity Regulations: Compliance and Risk Management Strategies","S. Kulshrestha; N. Acharya; R. Pal; L. Vijayvargiya","Manipal University, Jaipur; Manipal University, Jaipur; ICFAI, Hyderabad; Manipal University, Jaipur","2024 International Conference on Innovative Computing, Intelligent Communication and Smart Electrical Systems (ICSES)","12 Mar 2025","2024","","","1","5","Within the scope of this investigation paper, the vital intersection of cybersecurity rules and the Internet of Things (IoT) is investigated, with a particular emphasis placed on compliance and threat operation tactics. Businesses have become more concerned about their susceptibility to cyber threats as the Internet of Things (IoT) bias has spread across a variety of fields. This has led to an increase in the number of nonsupervisory interventions that are targeted at safeguarding data sequestration and security. This paper elucidates the geography of Internet of Things cybersecurity regulations by conducting a comprehensive review of existing literature and nonsupervisory fabrics. In a similar vein, the article investigates the difficulties that associations encounter when attempting to adhere to these requirements and outlines effective threat operation tactics that can help mitigate the cybersecurity risks that are connected with Internet of Things deployments. This paper aims to assist policymakers, diligent interpreters, and cybersecurity professionals in navigating the complex terrain of Internet of Things (IoT) cybersecurity regulations and enhancing the adaptability of IoT ecosystems against cyber pitfalls. This will be accomplished by providing insight into nonsupervisory compliance conditions and threat mitigation approaches.","","979-8-3315-4362-4","10.1109/ICSES63760.2024.10910714","","https://ieeexplore.ieee.org/stamp/stamp.jsp?arnumber=10910714","IoT;Cybersecurity;Regulations;Compliance;Risk Management;Strategies","Geography;Reviews;Navigation;Prevention and mitigation;Ecosystems;Regulation;Fabrics;Internet of Things;Computer security;Business","","","","19","IEEE","12 Mar 2025","","","IEEE","IEEE Conferences"
"Chapter 4 Safety Regulations and Facility Liability","J. F. Gustin",NA,Safety Management: A Guide for Facility Managers,"","2008","","","71","84","A safety management program that blends management commitment with employee involvement is the key to meeting the myriad safety challenges in any organization. Joseph Gustin’s Safety Management: A Guide for Facility Managers, Second Edition addresses the complexities of safety management in detail, explaining how to systematically identify, evaluate, and prevent hazards. See what’s new in the Second Edition: Cross-comparison of old vs new OSHA standards Update on employer compliance requirements to ADA with reference to court decisions New ergonomic standards Explanation of revisions to OSHA workplace inspection/investigation procedures and recordkeeping rules New material on violence in the workplace, including checklists, case studies, and recommendations Keeping the focus on managing safety function, this second edition elucidates safety and health issues including liability and how to better carry out the tasks that ensure a safe working environment. It summarizes statistics examines key areas of safety management. Gustin delineates the rights and responsibilities of employer and employee and outlines the Whistleblower act and its impact. He also covers violence in the workplace, ADA compliance, conducting the safety audit, recordkeeping, safety inspections, and change management. The book highlights major aspects of safety and health management that are not well-covered in other texts, such as the written safety plan and a written hazard communication program safety plan. Gustin explains each element of written plan and how to adapt the sample plan to any organization. At the core of this second edition is the recognition that corporations and other organizations have a moral, ethical, and legal responsibility to provide a safe environment for everyone who enters their facilities.","","9788770222426","","","https://ieeexplore.ieee.org/xpl/ebooks/bookPdfWithBanner.jsp?fileName=9558581.pdf&bkn=9558560&pdfType=chapter","","","","","","","","4 Oct 2021","","","River Publishers","River eBook Chapters"
"Assessing the accuracy of legal implementation readiness decisions","A. K. Massey; B. Smith; P. N. Otto; A. I. Antón","North Carolina State University, Raleigh, NC, USA; North Carolina State University, Raleigh, NC, USA; North Carolina State University, Raleigh, NC, USA; North Carolina State University, Raleigh, NC, USA",2011 IEEE 19th International Requirements Engineering Conference,"20 Oct 2011","2011","","","207","216","Software engineers regularly build systems that are required to comply with laws and regulations. To this end, software engineers must determine which requirements have met or exceeded their legal obligations and which requirements have not. Requirements that have met or exceeded their legal obligations are legally implementation ready, whereas requirements that have not met or exceeded their legal obligations need further refinement. Research is needed to better understand how to support software engineers in making these determinations. In this paper, we describe a case study in which we asked graduate-level software engineering students to assess whether a set of software requirements for an electronic health record system met or exceeded their corresponding legal obligations as expressed in regulations created pursuant to the U.S. Health Insurance Portability and Accountability Act (HIPAA). We compare the assessment made by graduate students with an assessment made by HIPAA compliance subject matter experts. Additionally, we contrast these results with those generated by a legal requirements triage algorithm. Our findings suggest that the average graduate-level software engineering student is ill-prepared to write legally compliant software with any confidence and that domain experts are an absolute necessity. Our findings also indicate the potential utility of legal requirements metrics in aiding software engineers as they make legal compliance decisions.","2332-6441","978-1-4577-0924-1","10.1109/RE.2011.6051661","","https://ieeexplore.ieee.org/stamp/stamp.jsp?arnumber=6051661","legal requirements;requirements metrics","Law;Measurement;Software engineering;Software systems;Complexity theory","","11","1","34","IEEE","20 Oct 2011","","","IEEE","IEEE Conferences"
"Legal Solutions - Intelligent Chatbot using Machine Learning","K. R A; K. S; R. R","Department of Computer Science and Engineering, Sri Sairam Engineering College, Chennai, India; Department of Computer Science and Engineering, Sri Sairam Engineering College, Chennai, India; Department of Computer Science and Engineering, Sri Sairam Engineering College, Chennai, India",2023 Intelligent Computing and Control for Engineering and Business Systems (ICCEBS),"19 Mar 2024","2023","","","1","6","In the digital age, navigating legal complexities can be challenging for individuals lacking legal expertise or access to legal counsel. To address this issue, we present an innovative AI chatbot solution. This chatbot empowers users by offering fundamental legal knowledge, personalized instructions, and rapid responses aligned with specific document requirements and procedural nuances. Users also have the unique capability to engage in real-time discussions with qualified attorneys, enabling them to effectively manage intricate legal matters. Furthermore, our system allows users to customize searches based on their financial circumstances and geographic location, ensuring legal guidance tailored to their individual context. Leveraging advanced machine learning techniques, the chatbot autonomously retrieves and processes information pertinent to users' particular legal concerns, ensuring timely and accurate responses. This comprehensive approach seeks to democratize legal resource access, providing equal opportunities for individuals across society to seek clarity and assistance for their legal needs. This paper outlines the chatbot's architecture, NLP techniques, and machine learning algorithms while highlighting its potential to revolutionize legal support services","","979-8-3503-9458-0","10.1109/ICCEBS58601.2023.10448748","","https://ieeexplore.ieee.org/stamp/stamp.jsp?arnumber=10448748","Legal issues;queries;assistance;chatbot;attorney consultation;paraphrase-MiniLML6-v2;natural language processing (NLP);machine learning;artificial intelligence;cosine similarity","Schedules;Law;Process control;Machine learning;Chatbots;Tokenization;Real-time systems","","1","","8","IEEE","19 Mar 2024","","","IEEE","IEEE Conferences"
"Distributed Ledger Technology as a Tool for Voluntary Standardization Compliance in Emerging Technologies: A Legal View","D. Kyosev; A. G. Nil","Burgas, Bulgaria; Burgas, Bulgaria","2024 IEEE 48th Annual Computers, Software, and Applications Conference (COMPSAC)","26 Aug 2024","2024","","","1677","1680","Emerging technology products would benefit hugely from the introduction of voluntary standards. Those, however, are costly to adopt, especially for smaller players. Further, popularizing the standards and policing compliance is difficult. This paper makes the case for empowering the users to police the voluntary standards. Utilizing Distributed Ledger Technology (DLT), more precisely Directed Acyclic Graph will reduce the costs of recording and storing individual measurements for each product allowing users to claim compensation every time the product doesn't perform according to specifications. The paper discusses the specific requirements the product should meet to utilize DLT as compliance tool. It is also discussing the specific legal issues that entail from empowering users to police standard compliance.","2836-3795","979-8-3503-7696-8","10.1109/COMPSAC61105.2024.00264","","https://ieeexplore.ieee.org/stamp/stamp.jsp?arnumber=10633515","DLT;compliance;dispute resolution;voluntary standard","Industries;Costs;Image resolution;Distributed ledger;Law enforcement;Time measurement;Software","","","","25","IEEE","26 Aug 2024","","","IEEE","IEEE Conferences"
"Development of Assistance System for Online Dispute Resolution and Legal Advice Using AIML","N. K. Sahu; R. Soni; P. Namdeo; N. Mishra; P. H. Naidu; P. Pawar","Artificial Intelligence and Robotics, Gyan Ganga Institute of Technology and Science, Jabalpur, India; Computer Science and Engineering, Gyan Ganga Institute of Technology and Science, Jabalpur, India; Computer Science and Engineering, Gyan Ganga Institute of Technology and Science, Jabalpur, India; Computer Science and Engineering, Gyan Ganga Institute of Technology and Science, Jabalpur, India; Computer Science and Engineering, Gyan Ganga Institute of Technology and Science, Jabalpur, India; Computer Science and Engineering, Gyan Ganga Institute of Technology and Science, Jabalpur, India","2025 International Conference on Computational, Communication and Information Technology (ICCCIT)","24 Mar 2025","2025","","","142","146","In the present work, the main goal is to reduce the downsides of litigation and other traditional conflict resolution procedures. Many people and corporations avoid litigation due to its high costs, extended timelines, and mental stress. This methodology presents a fresh perspective on conflict resolution, one that makes use of technology to simplify the process and provides an affordable and easily accessible option. At the heart of this strategy is an Online Dispute Resolution (ODR) platform that allows for the digital resolution of disputes, doing away with the necessity for physical presence and the expenses that come along with it. Everyone from sole proprietors to large corporations, regardless of their level of legal knowledge, may utilize the platform because to its intuitive design. Eventually, this initiative seeks to enable individuals and companies to confidently and easily manage legal difficulties by reshaping the landscape of legal dispute resolution with an emphasis on speed, accessibility, and openness. Reduced legal fees, reduced time to resolution, and less emotional toll on parties are just a few of the many advantages of this strategy. People with private legal issues and small and medium-sized businesses (SMEs) resolving business conflicts are among our project's intended users.","","979-8-3315-1296-5","10.1109/ICCCIT62592.2025.10927904","","https://ieeexplore.ieee.org/stamp/stamp.jsp?arnumber=10927904","Online Dispute Resolution (ODR);Artificial Intelligence;Justice-Assist;Legal Advice System;Cost Effective Legal Solutions;Small and Medium Enterprises;Remote Legal Assistance","Heart;Costs;Law;Navigation;Human factors;Companies;Information and communication technology;Artificial intelligence;Business","","","","9","IEEE","24 Mar 2025","","","IEEE","IEEE Conferences"
"Improvement of reliabilities of regulations using a hierarchical structure in a genetic network","S. Kimura; M. Okada-Hatakeyama","Graduate School of Engineering, Tottori University, Tottori, Japan; RIKEN Center for Integrative Medical Sciences, Yokohama, Japan",2015 International Joint Conference on Neural Networks (IJCNN),"1 Oct 2015","2015","","","1","7","A number of genetic network inference methods have been proposed. These methods often infer many erroneous regulations. In order to decrease the number of erroneous regulations, this study uses a priori knowledge that biochemical networks exhibit hierarchical structures. This study detects the hierarchical structure in the target network using a hierarchical random graph model proposed by Clauset and colleagues. When the regulations inferred by the inference method are inconsistent with the detected hierarchical structure, we can conclude that they are unreasonable. However, it is not always easy to detect the hierarchical structure in the target network because of the regulations erroneously inferred by the inference method. In order to obtain a reasonable hierarchical structure, this study first infers a large number of genetic networks from the observed gene expression data by using a method that combines a genetic network inference method with a bootstrap method. We then extract a hierarchical structure from the inferred multiple genetic networks so that it is consistent with most of the networks. Through numerical experiments, we finally show that the use of the hierarchical structure in the network improves the reliabilities of regulations inferred by the genetic network inference method.","2161-4407","978-1-4799-1960-4","10.1109/IJCNN.2015.7280362","","https://ieeexplore.ieee.org/stamp/stamp.jsp?arnumber=7280362","","Reliability;Periodic structures;Search problems;Genetics;Time measurement","","","","15","IEEE","1 Oct 2015","","","IEEE","IEEE Conferences"
"Legal and Technical Aspects of Web Forensics","Y. U. Sonmez; A. Varol","Faculty of Technology, Firat University, Elazig, Turkey; Faculty of Technology, Firat University, Elazig, Turkey",2019 7th International Symposium on Digital Forensics and Security (ISDFS),"11 Jul 2019","2019","","","1","7","Web forensics is a discipline that has legal and technical aspects and deals with a continuously expanding problem. This study has been conducted for two reasons-to answer the question `Can criminal tendency be detected from web activities?' and to contribute to technical developments in computer forensics. Criminal records for conventional and cybercrimes committed in Turkey, detection of criminals, the sentences given, and the methods used have been examined. The technical developments in the literature dealing with web forensics have been investigated and emphasis has been laid on the types of crimes to be handled in order to develop new models. The process, method, technique, application and software of the web forensics procedure, which handles web activities, have been investigated. We observed that problems are encountered mainly at the stage of evidence analysis. The crime models that were analyzed in the legal department were determined in order to create a database for new models in the technical field.","","978-1-7281-2827-6","10.1109/ISDFS.2019.8757536","","https://ieeexplore.ieee.org/stamp/stamp.jsp?arnumber=8757536","web forensics;information technology law","Browsers;Forensics;Criminal law;Internet;Computer crime","","1","","14","IEEE","11 Jul 2019","","","IEEE","IEEE Conferences"
"Potential impact of HITECH security regulations on medical imaging","F. Prior; M. L. Ingeholm; B. A. Levine; L. Tarbox","Mallinckrodt Institute of Radiology, Washington University, Saint Louis, MO, USA; Informatics Application Group, Reston, VA, USA; ISIS Center, Georgetown University Medical Center, Washington D.C., DC, USA; Mallinckrodt Institute of Radiology, Washington University, Saint Louis, MO, USA",2009 Annual International Conference of the IEEE Engineering in Medicine and Biology Society,"13 Nov 2009","2009","","","2157","2160","Title XIII of Division A and Title IV of Division B of the American Recovery and Reinvestment Act (ARRA) of 2009 include a provision commonly referred to as the ldquoHealth Information Technology for Economic and Clinical Health Actrdquo or ldquoHITECH Actrdquo that is intended to promote the electronic exchange of health information to improve the quality of health care. Subtitle D of the HITECH Act includes key amendments to strengthen the privacy and security regulations issued under the Health Insurance Portability and Accountability Act (HIPAA). The HITECH act also states that ldquothe National Coordinatorrdquo must consult with the National Institute of Standards and Technology (NIST) in determining what standards are to be applied and enforced for compliance with HIPAA. This has led to speculation that NIST will recommend that the government impose the Federal Information Security Management Act (FISMA), which was created by NIST for application within the federal government, as requirements to the public Electronic Health Records (EHR) community in the USA. In this paper we will describe potential impacts of FISMA on medical image sharing strategies such as teleradiology and outline how a strict application of FISMA or FISMA-based regulations could have significant negative impacts on information sharing between care providers.","1558-4615","978-1-4244-3296-7","10.1109/IEMBS.2009.5332507","","https://ieeexplore.ieee.org/stamp/stamp.jsp?arnumber=5332507","","Biomedical imaging;NIST;Information security;US Government;Information technology;Medical services;Privacy;National security;Insurance;Health information management","Academies and Institutes;American Recovery and Reinvestment Act;Automatic Data Processing;Automatic Data Processing;Computer Security;Computer Security;Diagnostic Imaging;Health Insurance Portability and Accountability Act;Humans;Security Measures;Teleradiology;Teleradiology;Teleradiology;United States","11","","13","IEEE","13 Nov 2009","","","IEEE","IEEE Conferences"
"Radiated noise measurement system to estimate the EMI regulations compliance of a power electronic circuit","M. Hernando; A. Fernandez; M. Arias; M. Rodriguez; Y. Alvarez; F. Las-Heras","Departamento de Ingeniería Eléctrica, Electrónica, de Computadores y de Sistemas, Universidad de Oviedo, Gijon, Asturias, Spain; Departamento de Ingeniería Eléctrica, Electrónica, de Computadores y de Sistemas, Universidad de Oviedo, Gijon, Asturias, Spain; Departamento de Ingeniería Eléctrica, Electrónica, de Computadores y de Sistemas, Universidad de Oviedo, Gijon, Asturias, Spain; Departamento de Ingeniería Eléctrica, Electrónica, de Computadores y de Sistemas, Universidad de Oviedo, Gijon, Asturias, Spain; Departamento de Ingeniería Eléctrica, Electrónica, de Computadores y de Sistemas, Universidad de Oviedo, Gijon, Asturias, Spain; Departamento de Ingeniería Eléctrica, Electrónica, de Computadores y de Sistemas, Universidad de Oviedo, Gijon, Asturias, Spain",2007 IEEE International Symposium on Industrial Electronics,"5 Nov 2007","2007","","","2544","2549","One of the requirements that electronics circuits may satisfy are the conducted and irradiated noise specifications. While conducted noise is well covered in the literature, the radiated noise is not. Regulations about radiated noise impose limits in the noise measured three or ten meters far away the electronic equipment. These measurements are usually made in anechoic rooms, which are a very expensive equipment, and the measurement procedure is not a «plug-and-play» feature, but a carefully protocol of measurement is required. Once the electronic circuit has been tested, in case the regulation was not met, the designer unknowns the source of the problem, so the procedure to make the electronic circuit to comply with the regulation used to be a trial-and-mistake method, when the experience of the designer is essential. A new radiated noise measurement technique is proposed in this paper with two objectives: to simplify the measurement procedure and to have more information about the noise sources. The main idea is to scan the electric/field at two arbitrary but known distances. From these measurements, the Source Reconstruction Technique (SRT) allows the identification of the noise sources in the surface of the circuit and the field estimation at any distance, so that the regulation compliance can be evaluated. Moreover, if the regulation is not satisfied, the effect of the noise source modification can be tested, to find how the circuit must be modified to comply with the regulation.","2163-5145","978-1-4244-0754-5","10.1109/ISIE.2007.4375008","","https://ieeexplore.ieee.org/stamp/stamp.jsp?arnumber=4375008","","Noise measurement;Electromagnetic interference;Power electronics;Circuit noise;Circuit testing;Electronic circuits;Electronic equipment;Protocols;Electronic equipment testing;Surface reconstruction","","8","","6","IEEE","5 Nov 2007","","","IEEE","IEEE Conferences"
"Cyber law and espionage law as communicating vessels","A. Lubin","Post-Doctoral Cyber Research Fellow, Tufts University, Medford, MA, United States",2018 10th International Conference on Cyber Conflict (CyCon),"9 Jul 2018","2018","","","203","226","Existing legal literature would have us assume that espionage operations and ""below-the-threshold"" cyber operations are doctrinally distinct. Whereas one is subject to the scant, amorphous, and under-developed legal framework of espionage law, the other is subject to an emerging, ever-evolving body of legal rules, known cumulatively as cyber law. This dichotomy, however, is erroneous and misleading. In practice, espionage and cyber law function as communicating vessels, and so are better conceived as two elements of a complex system, Information Warfare (IW). This paper therefore first draws attention to the similarities between the practices - the fact that the actors, technologies, and targets are interchangeable, as are the knee-jerk legal reactions of the international community. In light of the convergence between peacetime Low-Intensity Cyber Operations (LICOs) and peacetime Espionage Operations (EOs) the two should be subjected to a single regulatory framework, one which recognizes the role intelligence plays in our public world order and which adopts a contextual and consequential method of inquiry. The paper proceeds in the following order: Part 2 provides a descriptive account of the unique symbiotic relationship between espionage and cyber law, and further explains the reasons for this dynamic. Part 3 places the discussion surrounding this relationship within the broader discourse on IW, making the claim that the convergence between EOs and LICOs, as described in Part 2, could further be explained by an even larger convergence across all the various elements of the informational environment. Parts 2 and 3 then serve as the backdrop for Part 4, which details the attempt of the drafters of the Tallinn Manual 2.0 to compartmentalize espionage law and cyber law, and the deficits of their approach. The paper concludes by proposing an alternative holistic understanding of espionage law, grounded in general principles of law, which is more practically transferable to the cyber realm.","2325-5374","978-9-9499-9043-6","10.23919/CYCON.2018.8405018","","https://ieeexplore.ieee.org/stamp/stamp.jsp?arnumber=8405018","international law;information warfare;espionage;cyber law;Tallinn Manual 2.0;sovereignty;diplomatic law;consular law;general principles of law","Law;Convergence;Manuals;Malware;Cyberattack;IP networks","","5","","","","9 Jul 2018","","","IEEE","IEEE Conferences"
