"Legal Driving for Autonomous Vehicles Through Law-Compliance Potential Fields","L. Song; L. Zhang; C. Zhao; X. Ma; J. Liu; S. Wu; Z. Wang; W. Yu; H. Wang","School of Vehicle and Mobility, Tsinghua University, Beijing, China; School of Vehicle and Mobility, Tsinghua University, Beijing, China; School of Mechanical Engineering, Beijing Institute of Technology, Beijing, China; School of Mechanical Engineering, Beijing Institute of Technology, Beijing, China; School of Vehicle and Mobility, Tsinghua University, Beijing, China; School of Vehicle and Mobility, Tsinghua University, Beijing, China; School of Vehicle and Mobility, Tsinghua University, Beijing, China; School of Vehicle and Mobility, Tsinghua University, Beijing, China; School of Vehicle and Mobility, Tsinghua University, Beijing, China",2024 IEEE 27th International Conference on Intelligent Transportation Systems (ITSC),"20 Mar 2025","2024","","","2310","2316","The widespread adoption of autonomous vehicles necessitates their compliance with existing traffic laws. However, while safety-oriented decision-making methods have matured, shortcomings in law compliance persist. To ensure that autonomous vehicles drive legally while prioritizing safety, a law-compliance potential fields-based approach is introduced. Firstly, this paper discusses the classification and constraints of traffic laws on vehicle states, outlining five principles for legal driving. Subsequently, law-compliance potential fields are established, incorporating factors related to roads, obstacles, and vehicle speeds. The potential fields-based model predictive control (MPC) controller is then employed to generate feasible trajectories, thereby enabling legal driving. Finally, the effectiveness of the proposed approach is verified through three representative scenarios including the intersection, the highway and the urban road. The results demonstrate that the method can ensure law compliance of autonomous vehicles in complex scenarios and can prioritize safety in extreme situations.","2153-0017","979-8-3315-0592-9","10.1109/ITSC58415.2024.10920121","National Key R&D Program of China(grant numbers:2022YFB2503005,2022YFB2503003); National Natural Science Foundation of China(grant numbers:52072215,52221005); Beijing Natural Science Foundation(grant numbers:L243025); ","https://ieeexplore.ieee.org/stamp/stamp.jsp?arnumber=10920121","","Law;Roads;Decision making;Focusing;Trajectory;Safety;Autonomous vehicles;Tuning;Intelligent transportation systems;Predictive control","","","","20","IEEE","20 Mar 2025","","","IEEE","IEEE Conferences"
"ALCM descending-phase guidance law including derivative of normal acceleration restriction","H. Li; W. Chen","School of Astronautics Beihang, University Haidian District, Beijing, China; School of Astronautics Beihang, University Haidian District, Beijing, China",2016 IEEE International Conference on Mechatronics and Automation,"5 Sep 2016","2016","","","1385","1390","A new multi-constraint guidance law of explicit form used in the descending period of the air-launched cruise missiles (ALCM) is proposed in this paper. This guidance law can satisfy the requirements on terminal height, velocity, flight-path angle, angle of attack and the time derivative of the normal acceleration. Firstly, an optimal problem is posed with these requirements, where the time derivative of the normal acceleration is used as control. Then we make this problem analytically solvable by reasonably linearizing the equations of motion. By conducting the trajectory simulations with different launch altitudes while considering the aerodynamic dispersions, the feasibility and robustness of the guidance law is verified.","2152-744X","978-1-5090-2396-7","10.1109/ICMA.2016.7558765","","https://ieeexplore.ieee.org/stamp/stamp.jsp?arnumber=7558765","ALCM descending period;normal acceleration;time derivative;multi-constraint;explicit guidance","Acceleration;Trajectory;Missiles;Mathematical model;Atmospheric modeling;Aerodynamics;Optimal control","","","","17","IEEE","5 Sep 2016","","","IEEE","IEEE Conferences"
"The Way Forward for Legal Knowledge Engineers in the Big Data Era with the Impact of AI Technology","Y. Qu; Z. Zhang; B. Bai","College of Marine Law and Humanities, Dalian Ocean University, Dalian, China; College of Marine Law and Humanities, Dalian Ocean University, Dalian, China; College of Marine Law and Humanities, Dalian Ocean University, Dalian, China",2023 6th International Conference on Artificial Intelligence and Big Data (ICAIBD),"10 Aug 2023","2023","","","225","229","In the era of big data, the application of AI technology has become a core driver of social development, widely affecting a wide range of fields and impacting on the development models of various industries. With changing business models and rising client expectations, the legal industry has become increasingly competitive, demanding high levels of professionalism as well as service and efficiency, and the Legal Knowledge Engineer (Legal Engineer) has emerged. This article takes the development of big data as the background, and analyses the current situation of AI technology applied to the legal field from the perspective of legal knowledge engineers, and what kind of qualities legal engineers should have in order to adapt to the development of AI technology under the situation of deep integration of AI and law. The dilemma of lack of perceptiveness of AI, weak motivation of academic output and AI algorithm bias faced by legal knowledge engineers, how to use their basic literacy to seek a new starting point and breakthrough in the era of big data.","2769-3554","978-1-6654-9125-9","10.1109/ICAIBD57115.2023.10206169","","https://ieeexplore.ieee.org/stamp/stamp.jsp?arnumber=10206169","legal knowledge engineer;AI technology;big data era","Knowledge engineering;Industries;Law;Big Data;Data models;Business","","3","","12","IEEE","10 Aug 2023","","","IEEE","IEEE Conferences"
"Construction of ODR platform of engineering construction laws and regulations based on cloud computing technology","Y. Gao; X. Sun",Xi'an Eurasia University; Xi 'an Xincheng District Comprehensive and Grid Service Management Center,2021 2nd International Conference on Big Data & Artificial Intelligence & Software Engineering (ICBASE),"3 Feb 2022","2021","","","722","727","With the implementation of the strategy of ""governing the country by law"", it has promoted the normal operation of all walks of life in the whole society under the supervision of legal system. Especially in the construction industry, the traditional construction disputes have a long settlement cycle and a single solution, which directly affects the construction quality of the project and the basic interests of the masses. The ODR platform of engineering construction laws and regulations based on cloud computing technology provides a new solution channel for various disputes in the construction industry, and it is also an important means to assist the reasonable application of engineering construction laws and regulations.","","978-1-6654-2709-8","10.1109/ICBASE53849.2021.00141","","https://ieeexplore.ieee.org/stamp/stamp.jsp?arnumber=9696067","Cloud computing technology;Engineering construction laws and regulations;The ODR platform","Computers;Cloud computing;Costs;Law;Regulation;Personnel;Construction industry","","","","5","IEEE","3 Feb 2022","","","IEEE","IEEE Conferences"
"The Mining and Analysis of Affective Law","T. He; H. Chen","School of Applied Mathematics, Central University of Finance and Economics, Beijing, China; Equipment Research Institute of PLA's Second Artillery, Beijing, China",2010 International Conference on Computational and Information Sciences,"4 Feb 2011","2010","","","1130","1133","According to the affective model based on rough fuzzy sets, this paper presents a new method to mine and analyze affective dynamic transition law. This method combines Markov chain with rough fuzzy sets, and mines affective dynamic transition law in stable environment. The definition of affective entropy enables us to analyze affective dynamic transition law conveniently. Simulation shows that the new method is reasonable.","","978-1-4244-8814-8","10.1109/ICCIS.2010.280","","https://ieeexplore.ieee.org/stamp/stamp.jsp?arnumber=5709479","Affective computing;Law mining;Rough fuzzy sets;Markov chain;Affective entropy","Markov processes;Computational modeling;Entropy;Mathematical model;Fuzzy sets;Analytical models;Biological system modeling","","1","","10","IEEE","4 Feb 2011","","","IEEE","IEEE Conferences"
"A 3D nonlinear guidance law with impact terminal angle constraints","X. Li; L. Wang; K. Chen; X. Yan; X. Fan; B. Ding","Department 3, The Second Artillery Engineering University, Xi'an, Shaanxi, China; Department 3, The Second Artillery Engineering University, Xi'an, Shaanxi, China; Department 3, The Second Artillery Engineering University, Xi'an, Shaanxi, China; Department 3, The Second Artillery Engineering University, Xi'an, Shaanxi, China; Petty Officer Academy, The Second Artillery Engineering University, China; Petty Officer Academy, The Second Artillery Engineering University, China",2015 Chinese Automation Congress (CAC),"18 Jan 2016","2015","","","2242","2246","Generalized model predictive static programming (G-MPSP) technique is presented in this paper in the continuous time framework for rapidly solving a class of 3D nonlinear optimal control problems with hard terminal constraints. A key feature of the technique is backward propagation of a small-dimensional weight matrix dynamics, using which the control history got updated. It leads to a static optimization problem and it is the reason for its high computational efficiency. Various maneuvering ground targets is considered in the simulation studies. The simulation results show that impact angle constraints are met in addition to achieving near zero miss distance and the variation in the lateral acceleration history is quite smooth throughout the engagement.","","978-1-4673-7189-6","10.1109/CAC.2015.7382876","","https://ieeexplore.ieee.org/stamp/stamp.jsp?arnumber=7382876","guidance;nonlinear optimal control;impact terminal angle constraint;model predictive static programming","Yttrium","","","","14","IEEE","18 Jan 2016","","","IEEE","IEEE Conferences"
"Understanding Legal Documents: Classification of Rhetorical Role of Sentences Using Deep Learning and Natural Language Processing","S. R. Ahmad; D. Harris; I. Sahibzada","IBM; Elmhurst College, USA; IBM",2020 IEEE 14th International Conference on Semantic Computing (ICSC),"12 Mar 2020","2020","","","464","467","Automatically extracting the patterns of reasoning from complex legal documents can make legal systems more effective by increasing on-time case processing and the case clearance rate. The crucial task to achieve this is to automatically classify sentences in legal documents into categories based on their content. In this paper, a deep learning model is proposed that breaks down legal documents and classifies the rhetorical types of sentences. A hypothesis is tested, that using a small set of labelled data, deeper and more accurate models for the processing of legal documents can be constructed. This will automate the processing of legal documents hence decreasing, and ultimately eliminating the backlog that currently exists throughout various legal systems. This work can be generalized for legal appeals cases in diverse fields. The various configurations used to train the Bidirectional Long Short-Term Memory (Bi-LSTM) model will be compared along with a variety of embeddings. The experiments obtained their highest accuracy using the Bi-LSTM model with 300-dimensional GloVe embeddings compared to the previous techniques used for the semantic understanding of law related documents.","2325-6516","978-1-7281-6332-1","10.1109/ICSC.2020.00089","","https://ieeexplore.ieee.org/stamp/stamp.jsp?arnumber=9031483","Classification, Bi LSTMs, Embeddings, Rhetorical Role","Law;Semantics;Neural networks;Support vector machines;Task analysis;Legislation","","9","","26","IEEE","12 Mar 2020","","","IEEE","IEEE Conferences"
"Use of gas law and pulmonary compliance to simulate healthy human lung ventilation","Yongming Cai; Xuenong Zhang; Fuhua Chen; Man Luo; Yong Tang","Department of Medical Information Engineering, GuangDong Pharmaceutical University, Guangzhou, China; Department of Medical Information Engineering, GuangDong Pharmaceutical University, Guangzhou, China; Department of Medical Information Engineering, GuangDong Pharmaceutical University, Guangzhou, China; Department of Medical Information Engineering, GuangDong Pharmaceutical University, Guangzhou, China; Department of Computer Science, South China Normal University, Guangzhou, China","2012 6th International Conference on New Trends in Information Science, Service Science and Data Mining (ISSDM2012)","13 Jun 2013","2012","","","79","83","This paper presents a model of the lung mechanics which simulates the pulmonary alveolar ventilation. The gas laws and pulmonary compliance theories are used to establish the mathematical model of the ventilation. Our results show that the lung can be simulated by the model. Our lung model controls respiratory function through the control of internal pressure.","","978-89-94364-20-9","","","https://ieeexplore.ieee.org/stamp/stamp.jsp?arnumber=6528409","Ideal Gas Law;Model Lung;Pulmonary Compliance","","","","","8","","13 Jun 2013","","","IEEE","IEEE Conferences"
"The regulatory world and the machine: Harmonizing legal requirements and the systems they affect","D. G. Gordon","Engineering and Public Policy, Carnegie Mellon University, Pittsburgh, PA, USA",2013 21st IEEE International Requirements Engineering Conference (RE),"21 Oct 2013","2013","","","381","384","The past decade has seen a substantial increase in the issuance of privacy and security regulations governing personal information. Ensuring system and organizational compliance is both more important and more difficult than ever before, as the penalties have become more severe, and regulations more complex and nuanced. This also presents substantial difficulties for multi-national companies, as different states, countries, or regions do not adhere to a uniform standard, resulting in a mixed set of regulations for the systems they govern. In this work, I describe a framework to address this issue, referred to as requirements water marking, wherein requirements from different jurisdictions that govern the same system may be evaluated and reduced to a single standard of care, establishing a “high water mark” for regulatory compliance and reducing requirements complexity. The framework, which draws on work in requirements specification languages and requirements comparison, allows engineers and legal experts to systematically simplify compliance and determine both high and low standards of care, while maintaining traceability back to the original legal text. In addition, I investigate the proposed value of legal requirements models, demonstrating the relationship between proposed value of these models to organizational decision-making and the validity of the model.","2332-6441","978-1-4673-5765-4","10.1109/RE.2013.6636760","","https://ieeexplore.ieee.org/stamp/stamp.jsp?arnumber=6636760","","Law;Organizations;Standards organizations;Industries;Conferences","","2","","31","IEEE","21 Oct 2013","","","IEEE","IEEE Conferences"
"Extending XACML to express and enforce laws and regulations privacy policies","T. Alshugran; J. Dichter; A. Rusu","Department of Computer Science and Engineering, University of Bridgeport, Bridgeport, CT, USA; Department of Computer Science and Engineering, University of Bridgeport, Bridgeport, CT, USA; Department of Software Engineering, Fairfield University, Fairfield, CT, USA","2015 Long Island Systems, Applications and Technology","16 Jul 2015","2015","","","1","5","Some software applications are developed to collect, store, and manage users' personal, medical, or financial information. In the United States, such applications are required to preserve users' privacy and to be compliant with the federal privacy laws and regulations. To formally guarantee compliance with federal regulations, it is necessary to express the privacy rules enforced by those regulations in a standard policy specification language. In this work we evaluate the eXtensible Access Control Model Language (XACML) as a formal specification language for privacy laws and regulations. Furthermore, we evaluate XACML features and attributes to extend it in order to enforce those privacy rules.","","978-1-4799-8643-9","10.1109/LISAT.2015.7160190","","https://ieeexplore.ieee.org/stamp/stamp.jsp?arnumber=7160190","Privacy Policies;Federal Regulations;Specification Languages;Access Control Models;XACML","Privacy;Access control;Web services;Law;XML;Standards;Context","","4","","15","IEEE","16 Jul 2015","","","IEEE","IEEE Conferences"
"All-weather and all-terrain intelligent vehicle for law enforcement applications","B. Fujalkowski","Cracow Univ. of Technol., Krakow, Poland",Proceedings of the Intelligent Vehicles '94 Symposium,"6 Aug 2002","1994","","","509","514","The author selected neuro-fuzzy reasoning based motion control that is propulsion, dispulsion, suspension and conversion control algorithms to the mechatronically controlled intelligent vehicle. Fuzzy logic was chosen because of the following characteristics. It is easier to implement driver skills using neuro-fuzzy reasoning based motion control than using conventional motion control algorithms. It filters even the uncertainty of the precision of the sensors. Therefore, the intelligent vehicle may move as smoothly as a well-skilled or experienced human being along straight and curved routes on the hostile location or battlefield. Motion control for an intelligent vehicle requires many of the same elements that the military command, control communication and intelligence (C/sup 3/I) systems use. The all-weather and all-terrain intelligent vehicle will have two types of moving mode, IR vision-camera mode and US sonar mode, originating from the differing methods used to detect the intelligent vehicle position.","","0-7803-2135-9","10.1109/IVS.1994.639570","","https://ieeexplore.ieee.org/stamp/stamp.jsp?arnumber=639570","","Intelligent vehicles;Law enforcement;Motion control;Intelligent sensors;Sonar detection;Propulsion;Fuzzy logic;Filters;Uncertainty;Sensor phenomena and characterization","","","","14","IEEE","6 Aug 2002","","","IEEE","IEEE Conferences"
"Leveraging AI-Driven Chatbots for Legal Literacy: Advanced Computing and Communication Technologies for Legal Awareness","C. Trivedi; S. Kumar; I. Mohd; R. Bhalla; N. Ahmad Lone; D. Dogra","University Institute of Legal Studies, Chandigarh University, Punjab, India; University Institute of Legal Studies, Chandigarh University, Punjab, India; University Institute of Legal Studies, Chandigarh University, Punjab, India; University Institute of Legal Studies, Chandigarh University, Punjab, India; University Institute of Legal Studies, Chandigarh University, Punjab, India; University Institute of Legal Studies, Chandigarh University, Punjab, India",2024 International Conference on Artificial Intelligence and Quantum Computation-Based Sensor Application (ICAIQSA),"21 Feb 2025","2024","","","1","7","In a democratic society, public legal awareness is crucial for empowering citizens with knowledge of their rights and obligations. However, the vast complexity and volume of legal information can make it difficult for non-experts to access and understand their legal standing. This paper explores the development and deployment of AI-driven chatbot systems aimed at enhancing public legal literacy. These systems leverage advanced computing techniques, including natural language processing (NLP) and machine learning (ML) algorithms, to process legal queries and deliver personalized legal information to users in real time. The architecture, scalability, and implementation challenges of deploying these chatbots across diverse communication platforms (e.g., web, mobile) are examined. Additionally, the paper addresses the potential of these systems to bridge the gap in legal knowledge for underserved populations and discusses the importance of real-time communication technologies for ensuring effective system performance. Finally, the paper explores future advancements to further integrate AI and communication technologies for widespread legal literacy.","","979-8-3315-1795-3","10.1109/ICAIQSA64000.2024.10882305","","https://ieeexplore.ieee.org/stamp/stamp.jsp?arnumber=10882305","AI-powered chatbots;public legal awareness;national laws;natural language processing;machine learning;legal education","Law;Scalability;Education;Computer architecture;Chatbots;Communications technology;Real-time systems;Service-oriented architecture;Complexity theory;Testing","","","","29","IEEE","21 Feb 2025","","","IEEE","IEEE Conferences"
"Developing Production Rule Models to Aid in Acquiring Requirements from Legal Texts","J. C. Maxwell; A. I. Anton","North Carolina State University, USA; North Carolina State University, USA",2009 17th IEEE International Requirements Engineering Conference,"17 Nov 2009","2009","","","101","110","Regulatory compliance is an important consideration for requirements engineering because recent regulations impose costly penalties for noncompliance. This paper details how developing production rule models can aid in acquiring software requirements from regulatory texts. Production rules enable requirements engineers to gain valuable domain knowledge of a particular legal text by providing the ability to receive precise answers to a specific query. In particular, a production rule model facilitates communication between requirements engineers and legal domain experts, supports and augments requirements elicitation, and resolves ambiguity. Prior work in this area has failed to detail a precise methodology for translating a legal text into production rules, and considered using production rule models for aiding requirements elicitation and validation. This paper introduces our production rule modeling methodology, and demonstrates this methodology using examples from a production rule model for four sections of the U.S. Heath Insurance Portability and Accountability Act (HIPAA).","2332-6441","978-0-7695-3761-0","10.1109/RE.2009.21","","https://ieeexplore.ieee.org/stamp/stamp.jsp?arnumber=5328596","Requirements engineering;regulatory compliance;production rule modeling;logic programming","Production;Law;Legal factors;Insurance;Privacy;Knowledge engineering;Costs;Government;Protection;Legislation","","41","1","31","IEEE","17 Nov 2009","","","IEEE","IEEE Conferences"
"Research on the Construction of Maritime Legal Knowledge Graph","L. Yiming; D. Li","School of Electronic Engineering, Naval University of Engineering, Wuhan, China; School of Electronic Engineering, Naval University of Engineering, Wuhan, China",2022 7th International Conference on Computer and Communication Systems (ICCCS),"15 Aug 2022","2022","","","903","908","As the marine industry booms, the maritime legal documents are of great importance to the maneuver on the sea. However, the traditional way of consulting the text can not meet the demand of maritime operation nowadays. This paper aims to explore a way to extract and strengthen data from maritime legal texts to better support legal question answering. To mine knowledge from unstructured maritime laws and regulations, this paper proposes a method to build the maritime legal knowledge graph. To extract information from unstructured texts, BERT+BiLSTM+CRF is used for named entity recognition. DeepKE toolkit is used for relation extraction. And to strengthen the logics between entities, heterogeneous nodes are introduced to enhance the semantic associations in the maritime legal knowledge graph. The document-enhanced knowledge graph expanded in scale, so it can better support subsequent intelligent applications.","","978-1-6654-5060-7","10.1109/ICCCS55155.2022.9845845","","https://ieeexplore.ieee.org/stamp/stamp.jsp?arnumber=9845845","knowledge graph;maritime law;named entity recognition;heterogeneous entities","Law;Text recognition;Semantics;Pipelines;Ontologies;Information retrieval;Regulation","","1","","16","IEEE","15 Aug 2022","","","IEEE","IEEE Conferences"
