"An Adaptive Line-of-Sight Guidance Law for Path Following of AUV","S. Fu; J. Wang; H. Zhang; X. Zhou; X. Guan","Wuhan Second Ship Design and Research Institute, Wuhan, China; Wuhan Second Ship Design and Research Institute, Wuhan, China; Wuhan Second Ship Design and Research Institute, Wuhan, China; Wuhan Second Ship Design and Research Institute, Wuhan, China; Wuhan Second Ship Design and Research Institute, Wuhan, China",2024 China Automation Congress (CAC),"13 Feb 2025","2024","","","7256","7260","Line-of-Sight (LOS) guidance law is widely used for path following of autonomous underwater vehicle (AUV) due to its simplicity and effectiveness. However, LOS guidance law has a contradiction between rapidity and overshoot, as well as a steady-state error caused by waves, wind and ocean currents. This paper proposes an adaptive LOS (ALOS) guidance law that can balance rapidity and overshoot while compensating for sideslip angle. The proposed algorithm uses adaptive parameter based on the cross-track error to real-time adjust the look-ahead distance and adaptively calculate a reasonable desired heading angle. An adaptive integral state is designed based on the adaptive parameter to compensate the impact of sideslip angle and then calculate the desired heading angle. Through stability analysis, it is proven that ALOS has uniform semiglobal exponential stability (USGES) at the balancing point. Finally, lake trials results shows that ALOS effectively suppressed overshoot and compensated for disturbance of waves, wind and ocean currents while reducing lateral cross-track error by 52.3% in similar converge speed with LOS. ALOS can effectively improve robustness of control and enhance path following performance of AUV.","2688-0938","979-8-3503-6860-4","10.1109/CAC63892.2024.10864939","","https://ieeexplore.ieee.org/stamp/stamp.jsp?arnumber=10864939","autonomous underwater vehicle;path following;adaptive line-of-sight(ALOS);look-ahead distance","Adaptive systems;Navigation;Oceans;Line-of-sight propagation;Lakes;Stability analysis;Robustness;Real-time systems;Steady-state;Convergence","","","","10","IEEE","13 Feb 2025","","","IEEE","IEEE Conferences"
"A novel source coding technique for wireless sensor networks based on Benford's law","E. Goldoni; P. Savazzi; P. Gamba","Dipartimento di Ing. Industriale e dellInformazione, University of Pavia, Pavia, Italy; Dipartimento di Ing. Industriale e dellInformazione, University of Pavia, Pavia, Italy; Dipartimento di Ing. Industriale e dellInformazione, University of Pavia, Pavia, Italy",2012 IEEE Workshop on Environmental Energy and Structural Monitoring Systems (EESMS),"10 Nov 2012","2012","","","32","34","Since its discovery in 1881, Benford's law has been verified in several application fields related to economics, physics and even in number theory. In particular, a random dataset obtained from physical measurements seems to be the best empirical example of its validity. Following this reasoning, we present a novel and fast source coding algorithm for wireless sensor measurements. In more details, the Benford's probability density distribution is exploited for Huffmann coding of measured values, considering the Benford probability density of the first digit. This results may be fast obtained assuming the Benford's law validity, without directly computing the a priori probabilities of the measured digits. Performance evaluation is provided by system simulations, comparing the obtained results with the computed a posteriori source entropy.","","978-1-4673-2738-1","10.1109/EESMS.2012.6348393","","https://ieeexplore.ieee.org/stamp/stamp.jsp?arnumber=6348393","","Wireless sensor networks;Source coding;Wireless communication;Atmospheric measurements;Particle measurements","","","","13","IEEE","10 Nov 2012","","","IEEE","IEEE Conferences"
"The Temperature Distribution Law of Dry-Type Air-Core Reactor and the Layout Scheme Design of Encapsulated Temperature Sensor","S. Lu; X. Yang; H. Li; Y. Jiao; X. Zhou; T. Tian","School of Electrical and Information Engineering, Changsha University of Science & Technology, Changsha, China; School of Electrical and Information Engineering, Changsha University of Science & Technology, Changsha, China; School of Electrical and Information Engineering, Changsha University of Science & Technology, Changsha, China; School of Electrical and Information Engineering, Changsha University of Science & Technology, Changsha, China; Electric Power Science, Research Institute State Grid Ningxia Electric Power Co.,Ltd., Yinchuan, China; Electric Power Science, Research Institute State Grid Ningxia Electric Power Co.,Ltd., Yinchuan, China","2023 8th International Conference on Control, Robotics and Cybernetics (CRC)","9 Apr 2024","2024","","","190","195","In order to realize the safe and stable operation of the power grid, it is necessary to monitor the reactor in operation reasonably. In order to put forward the layout scheme of wireless temperature sensor in the on-line temperature monitoring system of dry-type air-core reactor, the finite element temperature simulation calculation is carried out according to the principle of multi-physical field coupling, and the radial and axial temperature distribution laws of the reactor are summarized and analyzed. In the radial direction, the encapsulation temperature of the middle layer was higher than that of the outer layer. In the axial direction, the temperature gradually increases from the bottom to the top, and the highest hot spot of each layer is located at the upper part of the axial height of the reactor. The accuracy of the finite element simulation calculation was confirmed by the outermost encapsulation temperature of the infrared detection, and the layout scheme of the wireless temperature sensor was proposed. The simulation is carried out when different encapsulations fail. When the reactor fails, the hottest spot of temperature changes from the top of the reactor to the fault location. The closer to the fault location, the higher the temperature rises. And the fault occurs at any position in the axial direction, at least one sensor can detect the temperature change. Combined with the distribution of hot spots in normal operation and fault, the layout position of temperature sensor is verified to improve the effectiveness and reliability of temperature detection.","","979-8-3503-3058-8","10.1109/CRC60659.2023.10488534","National Natural Science Foundation of China; ","https://ieeexplore.ieee.org/stamp/stamp.jsp?arnumber=10488534","dry-type air-core reactor;finite element analysis;wireless temperature measurement;sensor layout","Temperature sensors;Encapsulation;Temperature measurement;Wireless communication;Temperature distribution;Wireless sensor networks;Layout","","","","22","IEEE","9 Apr 2024","","","IEEE","IEEE Conferences"
"Exponential control law for a multi-degree of freedom mobile robot","G. Ramirez; S. Zeghloul","Laboratoire de Mécanique des Solides - UMR, Futuroscope, France; Laboratoire de Mécanique des Solides - UMR, Futuroscope, France",2003 IEEE International Conference on Robotics and Automation (Cat. No.03CH37422),"10 Nov 2003","2003","1","","509","514 vol.1","In this paper, we describe the development of a nonlinear exponential control law for a multi-degree of freedom (MDOF) wheeled mobile robot. These vehicles have many advantages over the more classical 2-DOF mobile robots. Indeed, the MDOF vehicles can negotiate tight turns easily and are able to travel sideways. Nevertheless, the MDOF robots are over constrained systems, which are difficult to control. By this reason, MDOF robots are limited to simple applications, like following a guide-wire. In order to obtain an autonomous behavior, we propose the use of a nonlinear control law, which exponentially leads the robot to a desired position with a given orientation. A new set of error variables is defined in order to propose the control vector. This control vector makes the final configuration globally exponentially stable. Results of simulation, which illustrate the effectiveness of the control, are also included.","1050-4729","0-7803-7736-2","10.1109/ROBOT.2003.1241645","","https://ieeexplore.ieee.org/stamp/stamp.jsp?arnumber=1241645","","Mobile robots;Control systems;Wheels;Vehicles;Kinematics;State feedback;Equations;Error correction;Velocity control;Prototypes","","","","10","IEEE","10 Nov 2003","","","IEEE","IEEE Conferences"
"Confirmation of a Power Law Phase Screen Theory Relating TEC Rate of Change and Scintillation Indices at Equatorial and High Latitudes","C. S. Carrano; T. M. S. Espejo; K. M. Groves","Institute for Scientific Research, Boston College, MA, USA; Institute for Scientific Research, Boston College, MA, USA; Institute for Scientific Research, Boston College, MA, USA",2024 United States National Committee of URSI National Radio Science Meeting (USNC-URSI NRSM),"21 Mar 2024","2024","","","211","211","Ionospheric irregularities cause scintillation effects that adversely affect the performance of satellite-based communications and navigation systems. The space weather community has invested a significant effort to 1) detect where and when such irregularities occur, 2) statistically quantify the scintillations produced, and 3) assess the disruption of technological systems and services that can result in significant societal impact. Traditional methods for detecting and characterizing irregularities have utilized specialized and expensive GNSS scintillation monitors specifically designed to measure rapid signal fluctuations. From a coverage perspective, the number and availability of these sensors is quite limited. For this reason, we explore alternative methods for global irregularity monitoring and characterization using existing sensors and infrastructure. In an earlier work, we demonstrated that inexpensive (COTS) receivers that measure total electron content can provide quantitative measurements of integrated turbulence strength and the scintillation index, S4 (Carrano et al, JGR, 2019; Carrano et al., Proc. ION 2019). This work was subsequently generalized to provide quantitative predictions of the phase scintillation index, sigma-phi (Carrano et al, COSP AR, 2022). These techniques have been demonstrated and validated at equatorial latitudes, but not at high-latitudes until now.","","978-1-946815-19-4","10.23919/USNC-URSINRSM60317.2024.10464420","","https://ieeexplore.ieee.org/stamp/stamp.jsp?arnumber=10464420","","Global navigation satellite system;Fluctuations;Receivers;Sensor phenomena and characterization;Ions;Indexes;Monitoring","","","","0","","21 Mar 2024","","","IEEE","IEEE Conferences"
"Controlled Access to the Internet, Prevention of Illicit Uses and Fundamental Rights - A Criminal Law Experience in Light of the Italian ""Google Case""","G. Marra","Department of Law Sciences, University of Urbino, Urbino, Italy",2010 2nd International Conference on Evolving Internet,"1 Nov 2010","2010","","","210","214","The sentence of an Italian criminal court against three top managers of Google received much attention in Italy and abroad. It may be considered a “leading case” on the debate over the criminal responsibility of Service Providers (abbr. SP) for the omission of the duty to monitor the use of the Internet for illicit scopes and to prevent the commission of computer related crimes. The sentence did not recognize the existence of such general duty but sentenced to jail the three managers for the infringement of Italian privacy law. According to Court opinion the three manager did not complain with the duty to acquire the consent of all the individuals before the treatment of their personal data. A duty extended by the Court's decision to the case of the uploading, in GoogleVideo, of a defamatory video even if the treatment of personal data of the victim was made not by Google but by the uploader of the video. The Court bringing out the contents of privacy regulation created, at least, for the all SP, a de facto duty to prevent criminal conducts committed by others. This statement will be discussed underling that the active collaboration of SP with criminal law enforcement agencies is necessary for real security reasons but may be considered a lawful tool in the social control of computer related crime only if pressing limits of proportionality principle are satisfies.","2156-7190","978-1-4244-8150-7","10.1109/INTERNET.2010.48","","https://ieeexplore.ieee.org/stamp/stamp.jsp?arnumber=5616311","Computer related crimes;Prevention;Criminal Law;Internet Service Providers;Fundamental Rights","","","","","20","IEEE","1 Nov 2010","","","IEEE","IEEE Conferences"
"Computing adaptive backstepping control law using computer algebra systems","F. Pozo; F. Ikhouane","Departament de Matemàtica Aplicada III, Escola Universitària dEnginyeria Tècnica Industrialde Barcelona, Universitat Politècnica de Catalunya, Barcelona, Spain; Departament de Matemàtica Aplicada III, Escola Universitària dEnginyeria Tècnica Industrialde Barcelona, Universitat Politècnica de Catalunya, Barcelona, Spain","2006 IEEE Conference on Computer Aided Control System Design, 2006 IEEE International Conference on Control Applications, 2006 IEEE International Symposium on Intelligent Control","6 Feb 2009","2006","","","403","407","The backstepping-based adaptive tuning functions design is a recursive control scheme for uncertain systems that ensures reasonably good stability and performance properties of the dosed loop. However, the complexity of the control algorithm makes inevitable the use of digital computers to perform the calculation of the control law. To this end, we use the computer algebra system namely Maple. The symbolic manipulation of Maple provides an excellent platform to derive this recursive algorithm","2165-302X","0-7803-9797-5","10.1109/CACSD-CCA-ISIC.2006.4776680","","https://ieeexplore.ieee.org/stamp/stamp.jsp?arnumber=4776680","","Programmable control;Adaptive control;Backstepping;Control systems;Algebra;Control design;Nonlinear control systems;Control system analysis;Mathematics;Nonlinear systems","","","","20","IEEE","6 Feb 2009","","","IEEE","IEEE Conferences"
"An advisory system for open textured law","U. J. Schild","Department of Computing, Imperial College London, London, UK",[1988] Proceedings. The Fourth Conference on Artificial Intelligence Applications,"6 Aug 2002","1988","","","422","424","The author is developing an expert system based on and taking into account the fundamental open-texturedness of law, specifically case-law. Such a system can generate conflicting answers in many cases. Its role is to point out the different possible approaches to the legal problem at hand and the contradictory conclusions that may be reached. It must be able to supply explanations for its conclusions, i.e. supply the chain of legal argumentation and reasoning behind its conflicting answers. An advisory system of this kind could be a decision-making aid for a lawyer or a judge. The central problems of developing such a system are specified and the implementation of the system is discussed.<>","","0-8186-0837-4","10.1109/CAIA.1988.196148","","https://ieeexplore.ieee.org/stamp/stamp.jsp?arnumber=196148","","Law;Legal factors;Expert systems;Books","","","","7","IEEE","6 Aug 2002","","","IEEE","IEEE Conferences"
"A Semantically Rich Knowledge Graph to Automate HIPAA Regulations for Cloud Health IT Services","D. -y. Kim; K. P. Joshi","University of Maryland, Baltimore County, Baltimore, MD, USA; University of Maryland, Baltimore County, Baltimore, MD, USA","2021 7th IEEE Intl Conference on Big Data Security on Cloud (BigDataSecurity), IEEE Intl Conference on High Performance and Smart Computing, (HPSC) and IEEE Intl Conference on Intelligent Data and Security (IDS)","29 Jun 2021","2021","","","7","12","As healthcare organizations adopt cloud-based services to manage their patient data, compliance with the rules and policies of the Health Insurance Portability and Accountability Act (HIPAA) regulation becomes increasingly complex. At present, HIPAA rules are available only in large textual format and require significant human effort to implement in the Health IT systems. Moreover, every change in the regulation, like the recent relaxation in telehealth policy due to the COVID-19 pandemic, has to be manually implemented in the IT system. We have developed a semantically rich Knowledge graph, using Semantic Web technologies to represent HIPAA rules in a machine-processable format. This will significantly help in automatically reasoning of HIPAA policies. In this paper, we describe our design along with the results of our study of the current status of research on HIPAA ontology. We have validated our design against use cases defined by the US Department of Health and Human Services (HHS). This knowledge graph can be integrated with existing healthcare systems to provide automated compliance with HIPAA policies.","","978-1-6654-3927-5","10.1109/BigDataSecurityHPSCIDS52275.2021.00013","","https://ieeexplore.ieee.org/stamp/stamp.jsp?arnumber=9463546","HIPAA;Compliance;Knowledge Graph (Ontol-ogy);Semantic Web;Policy Expressions","Knowledge engineering;Semantic Web;Privacy;US Department of Health and Human Services;Conferences;Medical services;Ontologies","","14","","35","IEEE","29 Jun 2021","","","IEEE","IEEE Conferences"
"Using Games to Study Law of Motions in Mind","H. Iida; M. N. A. Khalid","Research Center for Entertainment Science, Japan Advanced Institute of Science and Technology, Nomi, Japan; Research Center for Entertainment Science, Japan Advanced Institute of Science and Technology, Nomi, Japan",IEEE Access,"4 Aug 2020","2020","8","","138701","138709","The development of games had been seen as an essential field of study in artificial intelligence. Although game concepts have been adopted in various problem domains, understanding the nature of game playing's underlying mechanism has been limited. This study investigates such a mechanism by adopting a logistic model of game outcome uncertainty where a measure of game refinement had been derived. Application of such a measure to the popular board and sports games have been conducted to determine its implication in determining sophisticated design and has defined the harmonic balance between skill and chance. A theoretical analysis using practical data confirms the effectiveness of the proposed model, where reasonable game length is determined based on the definition of a gamified experience. The model is further expanded with the analogy of physics in mind. The law of motions in the game is formalized by considering the derivatives of the game progress model, where the link between game refinement theory and flow theory is identified and discussed. In essence, the sophisticated game's underlying mechanism leads to a more natural yet pleasurable human experience.","2169-3536","","10.1109/ACCESS.2020.3012597","Japan Society for the Promotion of Science, in the framework of the Grant-in-Aid for Challenging Exploratory Research(grant numbers:19K22893); ","https://ieeexplore.ieee.org/stamp/stamp.jsp?arnumber=9151140","Game design;game refinement theory;gamified experience;law of motions;physics in mind","Games;Uncertainty;Acceleration;Logistics;Measurement uncertainty","","22","","27","CCBY","28 Jul 2020","","","IEEE","IEEE Journals"
"Multiclass Legal Judgment Outcome Prediction for Consumer Lawsuits using XGBoost and TPE","P. T. C. dos Santos; F. Henrique; V. Garcia; V. R. S. Ferreira; A. C. dos Santos Neto; J. C. Souza; C. Manfredini; J. V. F. França; J. M. C. Boaro; G. Braz Junior; A. C. Silva; A. C. Paiva; M. S. L. de Oliveira; E. W. B. A. L. Alves; R. U. Moreira e Moraes; J. S. Sobral Neto","Applied Computing Group - NCA, Federal University of Maranhão - UFMA, São Luís, MA, Brazil; Applied Computing Group - NCA, Federal University of Maranhão - UFMA, São Luís, MA, Brazil; Applied Computing Group - NCA, Federal University of Maranhão - UFMA, São Luís, MA, Brazil; Applied Computing Group - NCA, Federal University of Maranhão - UFMA, São Luís, MA, Brazil; Applied Computing Group - NCA, Federal University of Maranhão - UFMA, São Luís, MA, Brazil; Applied Computing Group - NCA, Federal University of Maranhão - UFMA, São Luís, MA, Brazil; Applied Computing Group - NCA, Federal University of Maranhão - UFMA, São Luís, MA, Brazil; Applied Computing Group - NCA, Federal University of Maranhão - UFMA, São Luís, MA, Brazil; Applied Computing Group - NCA, Federal University of Maranhão - UFMA, São Luís, MA, Brazil; Applied Computing Group - NCA, Federal University of Maranhão - UFMA, São Luís, MA, Brazil; Applied Computing Group - NCA, Federal University of Maranhão - UFMA, São Luís, MA, Brazil; Applied Computing Group - NCA, Federal University of Maranhão - UFMA, São Luís, MA, Brazil; Equatorial Energy S.A., São Luís, MA, Brazil; Equatorial Energy S.A., São Luís, MA, Brazil; Equatorial Energy S.A., São Luís, MA, Brazil; Equatorial Energy S.A., São Luís, MA, Brazil","2020 IEEE International Conference on Systems, Man, and Cybernetics (SMC)","14 Dec 2020","2020","","","881","886","A recurring problem for energy supply companies is the quality of guarantees service that is regulated in many cases. Nevertheless, there are many lawsuits against energy distribution companies, for several reasons, which increase these companies' operating costs, in many situations with cases that could be resolved through negotiation. Hence, the main aim of this work is to construct an insightful tool for forecasting court outcomes for energy sector litigation focused on building features gathered from the client's historical partnership and key data for litigation utilizing eXtreme Gradient Boosting (XGBoost) as a classifier, TPE as an optimizer and feature engineering. The idea is to understand how lawsuits more effort should be made to conduct a negotiation outside the court. The proposed method is divided into three steps: (1) data acquisition; (2) feature engineering; (3) classification and optimization when evaluated with a dataset of over 70 thousand lawsuits, with 81 different outcomes reaching TOP-3 accuracy of 84.08%.","2577-1655","978-1-7281-8526-2","10.1109/SMC42975.2020.9283094","","https://ieeexplore.ieee.org/stamp/stamp.jsp?arnumber=9283094","Legal Judgment Prediction;Machine Learning;XGBoost;TPE","Law;Energy resolution;Companies;Tools;Encoding;Forecasting;Optimization","","2","","23","IEEE","14 Dec 2020","","","IEEE","IEEE Conferences"
"Legal Design Through AI in Banking Contracts","L. Gatt; I. A. Caggiano; M. C. Gaeta; L. Aulino; E. Troisi; L. Izzo; C. C. Esposito; A. Fabrocini; D. Marino","Research Centre of European Private Law (ReCEPL), Università degli Studi Suor Orsola Benincasa, Naples, Italy; Research Centre of European Private Law (ReCEPL), University Suor Orsola Benincasa, Naples, IT; Research Centre of European Private Law (ReCEPL), Università degli Studi Suor Orsola Benincasa, Naples, Italy; University of Turin, Turin, IT; Research Centre of European Private Law (ReCEPL), University Suor Orsola Benincasa, Naples, IT; Humanities and Technologies: an integrated research path, Research Centre of European Private Law (ReCEPL), University Suor Orsola Benincasa, Naples, IT; Computer Science, University of Salerno, Salerno, IT; Earth Observation (National PhD program), University La Sapienza - Vanvitelli, Rome, Caserta, IT; VISA, Barcelona, ES","2024 IEEE International Conference on Metrology for eXtended Reality, Artificial Intelligence and Neural Engineering (MetroXRAINE)","24 Dec 2024","2024","","","1236","1241","Consumer protection in banking is a particularly relevant issue, especially in light of the increasing complexity of banking transactions and the related legal reference cases. For this reason, the adoption of pre-contractual disclosures and contractual texts as complete as possible has been mandated to enable the consumer to be fully aware of the characteristics of the contractual relationship. This has led to the creation of contracts that are particularly detailed and full of content, with graphics designed to reduce the size of the relevant documents but inadequate to allow an understanding of these documents. It is therefore necessary to change the paradigm in the drafting of contractual texts and pre-contractual disclosures through the adoption of legal design methodologies. In particular, added value could be provided by adopting AI and metrology techniques for measuring the level of clarity of contractual texts and subsequently creating a more user-friendly version of these.","","979-8-3503-7800-9","10.1109/MetroXRAINE62247.2024.10796406","","https://ieeexplore.ieee.org/stamp/stamp.jsp?arnumber=10796406","Legal Design;AI Act;regulatory perspectives;legal-ethical compliance by design;metrics;banking activities;contracts","Graphics;Extended reality;Neural engineering;Banking;Metrology;Particle measurements;Consumer protection;Complexity theory;Artificial intelligence;Contracts","","","","30","IEEE","24 Dec 2024","","","IEEE","IEEE Conferences"
