"JDX3UY7P","journalArticle","2009","Golnaz Elahi; Golnaz Elahi; Eric Yu; Eric Yu","Modeling and analysis of security trade-offs - A goal oriented approach","","","","10.1016/j.datak.2009.02.004","","In designing software systems, security is typically only one design objective among many. It may compete with other objectives such as functionality, usability, and performance. Too often, security mechanisms such as firewalls, access control, or encryption are adopted without explicit recognition of competing design objectives and their origins in stakeholders' interests. Recently, there is increasing acknowledgement that security is ultimately about trade-offs. One can only aim for ''good enough'' security, given the competing demands from many parties. This paper investigates the criteria for a conceptual modeling technique for making security trade-offs. We examine how conceptual modeling can provide explicit and systematic support for modeling and analyzing security trade-offs. We examine several existing approaches for dealing with trade-offs and security trade-offs in particular. From analyzing the limitations of existing methods, we propose an extension to the i^* Framework for security trade-off analysis, taking advantage of its multi-agent and goal orientation. The method was applied to several case studies used to exemplify existing approaches. The resulting models developed using different approaches are compared.","2009","2025-04-16 12:38:30","2025-04-16 12:38:30","","","","","","","","","","","","","","","","","","","","","","","","","https://doi.org/10.1016/j.datak.2009.02.004","","","","","","","","","","","","","","","","","","","","","","","","","","","","","","","","","","","","","","","","","","","","","","","",""
"K9KQP6A9","journalArticle","2009","Travis D. Breaux; Travis D. Breaux; J. D. Lewis; Jonathan D. Lewis; Paul N. Otto; Paul N. Otto; Annie I. Antón; Annie I. Antón","Identifying vulnerabilities and critical requirements using criminal court proceedings","","","","10.1145/1529282.1529360","","Information systems governed by laws and regulations are subject to civil and criminal violations. In the United States, these violations are documented in court records, such as complaints, indictments, plea agreements, and verdicts, which thus constitute a source of real-world software vulnerabilities. This paper reports on an exploratory case study to identify legal vulnerabilities and provides guidance to practitioners in the analysis of court documents. As legal violations occur after system deployment, court records reveal vulnerabilities that were likely overlooked during software development. We evaluate established requirements engineering techniques, including sequence and misuse case diagrams and goal models, as applied to criminal court records to identify mitigating requirements that improve privacy protections. These techniques, when properly applied, can help organizations focus their risk-management efforts on emerging legal vulnerabilities. We illustrate our analysis using criminal indictments involving the U.S. Health Insurance Portability and Accountability Act (HIPAA).","2009","2025-04-16 12:38:30","2025-04-16 12:38:30","","","","","","","","","","","","","","","","","","","","","","","","","https://doi.org/10.1145/1529282.1529360","","","","","","","","","","","","","","","","","","","","","","","","","","","","","","","","","","","","","","","","","","","","","","","",""
"S6VBM9MV","journalArticle","1997","Daniel Poulin; Daniel Poulin; Guy Huard; Guy Huard; Alain Lavoie; Alain Lavoie","The other formalization of law: SGML modelling and tagging","","","","10.1145/261618.261637","","Article Free Access Share on The other formalization of law: SGML modelling and tagging Authors: Daniel Poulin Centre de recherche en droit public, University of Montréal, C.P. 6128, succ. Centre-ville, Montréal(Québec), Canada H3C 3J7 Centre de recherche en droit public, University of Montréal, C.P. 6128, succ. Centre-ville, Montréal(Québec), Canada H3C 3J7View Profile , Guy Huard Centre de recherche en droit public, University of Montréal, C.P. 6128, succ. Centre-ville, Montréal(Québec), Canada H3C 3J7 Centre de recherche en droit public, University of Montréal, C.P. 6128, succ. Centre-ville, Montréal(Québec), Canada H3C 3J7View Profile , Alain Lavoie Centre de recherche en droit public, University of Montréal, C.P. 6128, succ. Centre-ville, Montréal(Québec), Canada H3C 3J7 Centre de recherche en droit public, University of Montréal, C.P. 6128, succ. Centre-ville, Montréal(Québec), Canada H3C 3J7View Profile Authors Info & Claims ICAIL '97: Proceedings of the 6th international conference on Artificial intelligence and lawJune 1997 Pages 82–88https://doi.org/10.1145/261618.261637Online:30 June 1997Publication History 5citation318DownloadsMetricsTotal Citations5Total Downloads318Last 12 Months0Last 6 weeks0 Get Citation AlertsNew Citation Alert added!This alert has been successfully added and will be sent to:You will be notified whenever a record that you have chosen has been cited.To manage your alert preferences, click on the button below.Manage my Alerts New Citation Alert!Please log in to your account Save to BinderSave to BinderCreate a New BinderNameCancelCreateExport CitationPublisher SiteeReaderPDF","1997","2025-04-16 12:38:31","2025-04-16 12:38:31","","","","","","","","","","","","","","","","","","","","","","","","","https://doi.org/10.1145/261618.261637","","","","","","","","","","","","","","","","","","","","","","","","","","","","","","","","","","","","","","","","","","","","","","","",""
"DNZLDPT7","journalArticle","2008","G. Grau; Gemma Grau; Xavier Franch; Xavier Franch; Neil Maiden; Neil Maiden","PRiM: An i * -based process reengineering method for information systems specification","Information & Software Technology","","","10.1016/j.infsof.2007.10.006","","","2008","2025-04-16 12:38:31","2025-04-16 12:38:31","","","","","","","Information & Software Technology","","","","","","","","","","","","","","","","","","https://doi.org/10.1016/j.infsof.2007.10.006","","","","","","","","","","","","","","","","","","","","","","","","","","","","","","","","","","","","","","","","","","","","","","","",""
"6U4JP5IV","journalArticle","2007","Xavier Franch; Xavier Franch; G. Grau; Gemma Grau; Enric Mayol; Enric Mayol; Carme Quer; Carme Quer; Claudia Ayala; Claudia P. Ayala; Carlos Cares; Carlos Cares; Fredy Navarrete; Fredy Navarrete; Mariela Haya; Mariela Haya; Pere Botella; Pere Botella","SYSTEMATIC CONSTRUCTION OF i STRATEGIC DEPENDENCY MODELS FOR SOCIO-TECHNICAL SYSTEMS","International Journal of Software Engineering and Knowledge Engineering","","","10.1142/s0218194007003148","","Goal- and agent-oriented models have become a consolidated type of artifact in various software and knowledge engineering activities. Several languages exist for representing such type of models but there is a lack of associated methodologies for guiding their construction up to the necessary level of detail. In this paper we present RiSD, a method for building Strategic Dependency (SD) models in the i* notation. RiSD is defined in a prescriptive way to reduce uncertainness when constructing the model. RiSD tackles three fundamental issues: (1) it tends to reduce the average size of the resulting models; (2) it defines some traceability relationships among model elements; (3) it provides some lexical and syntactical conventions. As a result, we may say that RiSD supports the construction process of goal- and agent-oriented models whilst increasing their understanding.","2007","2025-04-16 12:38:31","2025-04-16 12:38:31","","","","","","","International Journal of Software Engineering and Knowledge Engineering","","","","","","","","","","","","","","","","","","https://doi.org/10.1142/s0218194007003148","","","","","","","","","","","","","","","","","","","","","","","","","","","","","","","","","","","","","","","","","","","","","","","",""
"B736X4Y4","journalArticle","2011","Travis D. Breaux; Travis D. Breaux; Catherine Lotrionte; Catherine B. Lotrionte; Catherine B. Lotrionte","Towards a privacy management framework for distributed cybersecurity in the new data ecology","","","","10.1109/ths.2011.6107840","","Cyber security increasingly depends on advance notice of emerging threats as individuals, groups or nations attempt to exfiltrate information or disrupt systems and services. Advance notice relies on having access to the right information at the right time. This information includes trace digital evidence, distributed across public and private networks that are governed by various privacy policies, inter-agency agreements, federal and state laws and international treaties. To enable rapid and assured information sharing that protects privacy, the US government needs a means to balance privacy with the need to share. In this paper, we review US laws and policies governing government surveillance and describe key elements for a privacy management framework that seeks to enable government investigations while protecting privacy in a systematic way. The framework aligns existing Federal investigative guidelines for attributing a cyberattack with concerns for automated decision making that arise from the Fourth Amendment “reasonable expectation of privacy” and several fair information practice principles. We discuss technical challenges for those seeking to implement this framework.","2011","2025-04-16 12:38:32","2025-04-16 12:38:32","","","","","","","","","","","","","","","","","","","","","","","","","https://doi.org/10.1109/ths.2011.6107840","","","","","","","","","","","","","","","","","","","","","","","","","","","","","","","","","","","","","","","","","","","","","","","",""
"VPVU4DED","journalArticle","2012","Andrew Hilts; Andrew Hilts; Eric Yu; Eric Yu","Design and evaluation of the goal-oriented design knowledge library framework","","","","10.1145/2132176.2132226","","In this paper, we describe the motivation, development, features, and evaluation of the Goal-Oriented Design Knowledge Library (GO-DKL) framework. This framework encompasses a model and method for extracting, codifying and storing in a database, relational excerpts of design knowledge from scholarly publications. We also outline a method for analyzing such a knowledge base, which is intended to support information system designers to retrieve, contextualize and evaluate knowledge base contents in relation to their own unique projects. Such a system may help designers build on each others' ideas and support an emerging community of practice. The framework was evaluated by six information system design practitioners during semi-structured interviews. For this project, we codified design knowledge published in academic studies of online deliberation systems.","2012","2025-04-16 12:38:33","2025-04-16 12:38:33","","","","","","","","","","","","","","","","","","","","","","","","","https://doi.org/10.1145/2132176.2132226","","","","","","","","","","","","","","","","","","","","","","","","","","","","","","","","","","","","","","","","","","","","","","","",""
"GW5QY4GB","journalArticle","2005","Marie‐Francine Moens; Marie-Francine Moens","Combining structured and unstructured information in a retrieval model for accessing legislation","","","","10.1145/1165485.1165507","","Legislative sources are currently accessible via portal web sites. Users demand precise and exhaustive answers to their information queries. When legislation is drafted, it contains text-rich information that is increasingly marked with XML tags. The statute structure as signaled by XML markup can be exploited to more precisely answer free information queries. In this paper we report on several XML retrieval models that we explicitly designed for the retrieval of legislation. We show that the models provide more advanced access to the content of statutes.","2005","2025-04-16 12:38:34","2025-04-16 12:38:34","","","","","","","","","","","","","","","","","","","","","","","","","https://doi.org/10.1145/1165485.1165507","","","","","","","","","","","","","","","","","","","","","","","","","","","","","","","","","","","","","","","","","","","","","","","",""
"SG8PD6FH","journalArticle","2003","Guido Boella; Guido Boella; Leendert van der Torre; Leendert van der Torre","Permissions and obligations in hierarchical normative systems","","","","10.1145/1047788.1047818","","In this paper we discuss different types of permissions and their roles in deontic logic. We study the distinction between weak and strong permissions in the context of input/output logic, combining the logic with constraints, priorities and hierarchies of normative authorities. In this setting we observe that the notion of prohibition immunity no longer applies, and we introduce a new notion of permission as exception and a new distinction between static and dynamic norms. We show that strong permissions can dynamically change a normative system by adding exceptions to obligations, provide an explicit representation of what is permitted to the subjects of the normative system and allow higher level authorities to limit the changes that lower level authorities can do to the normative system.","2003","2025-04-16 12:38:34","2025-04-16 12:38:34","","","","","","","","","","","","","","","","","","","","","","","","","https://doi.org/10.1145/1047788.1047818","","","","","","","","","","","","","","","","","","","","","","","","","","","","","","","","","","","","","","","","","","","","","","","",""
"6MNQFXYH","journalArticle","2006","G. Grau; Gemma Grau; Xavier Franch; Xavier Franch; Silvana De Gyves Avila; S. Avila","J-PRiM: A Java Tool for a Process Reengineering i* Methodology","","","","10.1109/re.2006.36","","The i* approach is a consolidated modelling technique that has proven to be useful in the requirements engineering phases of software development. Using i* requires the adoption of a methodology for defining the models and tool support for manipulating them. For addressing those aspects, we propose J-PRiM, a tool that allows to define i* models by applying PRiM, our Process Reengineering i* Methodology.","2006","2025-04-16 12:38:35","2025-04-16 12:38:35","","","","","","","","","","","","","","","","","","","","","","","","","https://doi.org/10.1109/re.2006.36","","","","","","","","","","","","","","","","","","","","","","","","","","","","","","","","","","","","","","","","","","","","","","","",""
"PC9PMIL4","journalArticle","2009","Lawrence Chung; Lawrence Chung; Julio César Prado Leite; Julio Cesar Sampaio do Prado Leite","On Non-Functional Requirements in Software Engineering","","","","10.1007/978-3-642-02463-4_19","","Essentially a software system's utility is determined by both its functionality and its non-functional characteristics, such as usability, flexibility, performance, interoperability and security. Nonetheless, there has been a lop-sided emphasis in the functionality of the software, even though the functionality is not useful or usable without the necessary non-functional characteristics. In this chapter, we review the state of the art on the treatment of non-functional requirements (hereafter, NFRs), while providing some prospects for future directions.","2009","2025-04-16 12:38:35","2025-04-16 12:38:35","","","","","","","","","","","","","","","","","","","","","","","","","https://doi.org/10.1007/978-3-642-02463-4_19","","","","","","","","","","","","","","","","","","","","","","","","","","","","","","","","","","","","","","","","","","","","","","","",""
"HPYQPJI3","journalArticle","2003","Daniel M. Berry; Daniel M. Berry; Erik Kamsties; Erik Kamsties; Michael Krieger; Michael M. Krieger","From Contract Drafting to Software Specification: Linguistic Sources of Ambiguity","","","","","","This handbook is about writing software requirements specifications and legal contracts, two kinds of documents with similar needs for completeness, consistency, and precision. Particularly when these are written, as they usually are, in natural language, ambiguity—by any definition—is a major cause of their not specifying what they should. Simple misuse of the language in which the document is written is one source of these ambiguities. This handbook describes the ambiguity phenomenon from several points of view, including linguistics, software engineering, and the law. Several strategies for avoiding and detecting ambiguities are presented. Strong emphasis is given on the problems arising from the use of heavily used and seemingly unambiguous words and phrases such as “all”, “each”, and “every” in defining or referencing sets; positioning of “only”, “also”, and “even”; precedences of “and” and “or”; “a”, “all”, “any”, “each”, “one”, “some”, and “the” used as quantifiers; “or” and “and/or”; “that” vs. “which”; parallelism; pronouns referring to an idea; multiple adjectives; etc. Many examples from requirements documents and legal documents are examined. While no guide can overcome the careless or indifferent writer, this handbook is offered as a guide both for writing better requirements or contracts and for inspecting them for potential ambiguities.","2003","2025-04-16 12:38:35","2025-04-16 12:38:35","","","","","","","","","","","","","","","","","","","","","","","","","https://scholar.google.com/scholar?q=From%20Contract%20Drafting%20to%20Software%20Specification:%20Linguistic%20Sources%20of%20Ambiguity","","","","","","","","","","","","","","","","","","","","","","","","","","","","","","","","","","","","","","","","","","","","","","","",""
"8QPIZH74","journalArticle","2005","William Robinson; William N. Robinson","Implementing Rule-Based Monitors within a Framework for Continuous Requirements Monitoring","","","","10.1109/hicss.2005.306","","With the increasing complexity of information systems, it is becoming increasingly unclear as to how information system behaviors relate to stated requirements. Although requirements documents and Business Activity Monitoring can provide static and dynamic evidence for requirements compliance, neither provides a formal, real-time presentation of requirements satisfaction. The REQMON research project is constructing and validating methods and tools for requirements specification and real-time monitoring. The challenge is to simplify monitoring system construction while ensuring the fidelity and expressiveness of its feedback. To address this challenge, our integrative approach leverages a formal monitoring abstraction layer, dynamically configurable distributed monitors, and commercial software to define a theory for specifying, developing, and analyzing requirements monitoring systems. This article presents an implementation of rule-based monitors, which are derived from system requirements. Such an implementation can simplify the specification of temporal requirements monitors and can be efficient, as our analysis shows.","2005","2025-04-16 12:38:35","2025-04-16 12:38:35","","","","","","","","","","","","","","","","","","","","","","","","","https://doi.org/10.1109/hicss.2005.306","","","","","","","","","","","","","","","","","","","","","","","","","","","","","","","","","","","","","","","","","","","","","","","",""
"LBBSUPXL","journalArticle","2010","James Lockerbie; James Lockerbie; David M. Bush; David Bush; Neil Maiden; Neil Maiden; H.A.P. Blom; Henk A. P. Blom; Henk A. P. Blom; M.H.C. Everdij; Mariken H. C. Everdij","Using i* Modelling as a Bridge between Air Traffic Management Operational Concepts and Agent-based Simulation Analysis","","","","10.1109/re.2010.50","","This paper presents our experiences of exploring how i* modelling can be used as a bridge between informal air traffic management (ATM) operational concepts and formal agent-based simulation. We report our work on an EU airspace design project that describes a revised concept of operations for lower level airspace around airports, and includes simulation based safety analysis of the critical scenarios. We describe our research towards using i* to address two challenges – how to model the revised concept from the informal concept of operations document, and how to present safety critical scenarios to operational experts. Modelling strategic aspects of a concept of operations is new to ATM, and we draw upon our experiences to provide lessons learned and directions for future work.","2010","2025-04-16 12:38:36","2025-04-16 12:38:36","","","","","","","","","","","","","","","","","","","","","","","","","https://doi.org/10.1109/re.2010.50","","","","","","","","","","","","","","","","","","","","","","","","","","","","","","","","","","","","","","","","","","","","","","","",""
"I47NEVQ7","journalArticle","2002","Luiz Marcio Cysneiros; Luiz Marcio Cysneiros","Requirements engineering in the health care domain","","","","10.1109/icre.2002.1048548","","There are many different approaches to elicit requirements, each having strengths and weaknesses. Hence, some approaches may be more suitable to one domain than another. Moreover, some domains may require these approaches to be carefully applied or even adapted to work efficiently. Health care domain is one of these domains. It is a complex domain with many subtleties, such as political and legal issues that have to be taken into account. This work brings some of the lessons learned in more than six years working with several hospitals and laboratories. Particularly, this paper presents some elicitation techniques that had to be adapted in order to comply with the constraints imposed by several peculiarities intrinsic to this domain. It also points out some special considerations that must be taken into account regardless the method one chooses to elicit requirements.","2002","2025-04-16 12:38:36","2025-04-16 12:38:36","","","","","","","","","","","","","","","","","","","","","","","","","https://doi.org/10.1109/icre.2002.1048548","","","","","","","","","","","","","","","","","","","","","","","","","","","","","","","","","","","","","","","","","","","","","","","",""
"VNP9LF7E","journalArticle","2011","André Rifaut; André Rifaut","Compliance management with measurement frameworks","","","","10.1109/relaw.2011.6050268","","New regulatory regimes advocate the use of “goaloriented” regulations that are more flexible during regulatory conversations occurring between the regulators and the regulatees when new regulations are introduced. In that context, long-term “compliance agreements” between regulators and regulatees are needed. Using recent developments of the Measurement Theory, this paper shows that the concept of Measurement Framework (MF) for soft-systems is of particular importance for providing those compliance agreements. We show that with two kinds of goals and softgoals based on MF, one can improve (a) the elicitation of compliance requirements, (b) the structure of the compliance arguments for compliant requirements, and (c) the consistency between actual compliance at run-time and the intentional compliance at early stages of Requirements Engineering.","2011","2025-04-16 12:38:36","2025-04-16 12:38:36","","","","","","","","","","","","","","","","","","","","","","","","","https://doi.org/10.1109/relaw.2011.6050268","","","","","","","","","","","","","","","","","","","","","","","","","","","","","","","","","","","","","","","","","","","","","","","",""
"Y2UIYGMT","journalArticle","2006","Francis Chantree; Francis Chantree; Bashar Nuseibeh; Bashar Nuseibeh; Anne De Roeck; A. de Roeck; Anne De Roeck; Alistair Willis; Alistair Willis","Identifying Nocuous Ambiguities in Natural Language Requirements","","","","10.1109/re.2006.31","","We present a novel technique that automatically alerts authors of requirements to the presence of potentially dangerous ambiguities. We first establish the notion of nocuous ambiguities, which are those that are likely to lead to misunderstandings. We test our approach on coordination ambiguities, which occur when words such as and and or are used. Our starting point is a dataset of ambiguous phrases from a requirements corpus and associated human judgements about their interpretation. We then use heuristics, based largely on word distribution information, to automatically replicate these judgements. The heuristics eliminate ambiguities which people interpret easily, leaving the nocuous ones to be analysed and rewritten by hand. We report on a series of experiments that evaluate our heuristics' performance against the human judgements. Many of our heuristics achieve high precision, and recall is greatly increased when they are used in combination.","2006","2025-04-16 12:38:36","2025-04-16 12:38:36","","","","","","","","","","","","","","","","","","","","","","","","","https://doi.org/10.1109/re.2006.31","","","","","","","","","","","","","","","","","","","","","","","","","","","","","","","","","","","","","","","","","","","","","","","",""
