"VEHLKLE3","journalArticle","2009","Axel van Lamsweerde; Axel van Lamsweerde","Requirements Engineering: From System Goals to UML Models to Software Specifications","","","","","","Essential comprehensive coverage of the fundamentals of requirements engineering Requirements engineering (RE) deals with the variety of prerequisites that must be met by a software system within an organization in order for that system to produce stellar results. With that explanation in mind, this must-have book presents a disciplined approach to the engineering of high-quality requirements. Serving as a helpful introduction to the fundamental concepts and principles of requirements engineering, this guide offers a comprehensive review of the aim, scope, and role of requirements engineering as well as best practices and flaws to avoid. Shares state-of-the-art techniques for domain analysis, requirements elicitation, risk analysis, conflict management, and more Features in-depth treatment of system modeling in the specific context of engineering requirements Presents various forms of reasoning about models for requirements quality assurance Discusses the transitions from requirements to software specifications to software architecture In addition, case studies are included that complement the many examples provided in the book in order to show you how the described method and techniques are applied in practical situations.","2009","2025-04-16 12:38:36","2025-04-16 12:38:36","","","","","","","","","","","","","","","","","","","","","","","","","https://scholar.google.com/scholar?q=Requirements%20Engineering:%20From%20System%20Goals%20to%20UML%20Models%20to%20Software%20Specifications","","","","","","","","","","","","","","","","","","","","","","","","","","","","","","","","","","","","","","","","","","","","","","","",""
"JFNSLPWY","journalArticle","2004","Alan R. Hevner; Alan R. Hevner; Salvatore T. March; Salvatore T. March; Jin-Soo Park; Jinsoo Park; Jinsoo Park; Sudha Ram; Sudha Ram","Design science in information systems research","Management Information Systems Quarterly","","","10.2307/25148625","","Two paradigms characterize much of the research in the Information Systems discipline: behavioral science and design science. The behavioral-science paradigm seeks to develop and verify theories that explain or predict human or organizational behavior. The design-science paradigm seeks to extend the boundaries of human and organizational capabilities by creating new and innovative artifacts. Both paradigms are foundational to the IS discipline, positioned as it is at the confluence of people, organizations, and technology. Our objective is to describe the performance of design-science research in Information Systems via a concise conceptual framework and clear guidelines for understanding, executing, and evaluating the research. In the design-science paradigm, knowledge and understanding of a problem domain and its solution are achieved in the building and application of the designed artifact. Three recent exemplars in the research literature are used to demonstrate the application of these guidelines. We conclude with an analysis of the challenges of performing high-quality design-science research in the context of the broader IS community.","2004","2025-04-16 12:38:37","2025-04-16 12:38:37","","","","","","","Management Information Systems Quarterly","","","","","","","","","","","","","","","","","","https://doi.org/10.2307/25148625","","","","","","","","","","","","","","","","","","","","","","","","","","","","","","","","","","","","","","","","","","","","","","","",""
"STKRK7SR","journalArticle","2008","Aaron K. Massey; Aaron K. Massey; Paul N. Otto; Paul N. Otto; Annie I. Antón; Annie I. Antón","Aligning Requirements with HIPAA in the iTrust System","","","","10.1109/re.2008.53","","We describe a case study in which we evaluated an open-source electronic health record (EHR) systempsilas requirements for compliance with the U.S. Health Insurance Portability and Accountability Act (HIPAA). Our findings suggest that legal compliance must be requirements-driven, while establishing due diligence under the law must be test-driven.","2008","2025-04-16 12:38:37","2025-04-16 12:38:37","","","","","","","","","","","","","","","","","","","","","","","","","https://doi.org/10.1109/re.2008.53","","","","","","","","","","","","","","","","","","","","","","","","","","","","","","","","","","","","","","","","","","","","","","","",""
"8ZX9DRWI","journalArticle","2004","Ronald J. Brachman; Ronald J. Brachman; Hector J. Levesque; Hector J. Levesque","Knowledge Representation and Reasoning","","","","","","Knowledge representation is at the very core of a radical idea for understanding intelligence. Instead of trying to understand or build brains from the bottom up, its goal is to understand and build intelligent behavior from the top down, putting the focus on what an agent needs to know in order to behave intelligently, how this knowledge can be represented symbolically, and how automated reasoning procedures can make this knowledge available as needed.  This landmark text takes the central concepts of knowledge representation developed over the last 50 years and illustrates them in a lucid and compelling way. Each of the various styles of representation is presented in a simple and intuitive form, and the basics of reasoning with that representation are explained in detail. This approach gives readers a solid foundation for understanding the more advanced work found in the research literature. The presentation is clear enough to be accessible to a broad audience, including researchers and practitioners in database management, information retrieval, and object-oriented systems as well as artificial intelligence. This book provides the foundation in knowledge representation and reasoning that every AI practitioner needs. *Authors are well-recognized experts in the field who have applied the techniques to real-world problems * Presents the core ideas of KR&R in a simple straight forward approach, independent of the quirks of research systems *Offers the first true synthesis of the field in over a decade Table of Contents 1 Introduction * 2 The Language of First-Order Logic *3 Expressing Knowledge * 4 Resolution * 5 Horn Logic * 6 Procedural Control of Reasoning * 7 Rules in Production Systems * 8 Object-Oriented Representation * 9 Structured Descriptions * 10 Inheritance * 11 Numerical Uncertainty *12 Defaults *13 Abductive Reasoning *14 Actions * 15 Planning *16 A Knowledge Representation Tradeoff * Bibliography * Index","2004","2025-04-16 12:38:37","2025-04-16 12:38:37","","","","","","","","","","","","","","","","","","","","","","","","","https://scholar.google.com/scholar?q=Knowledge%20Representation%20and%20Reasoning","","","","","","","","","","","","","","","","","","","","","","","","","","","","","","","","","","","","","","","","","","","","","","","",""
"NTZP73QA","journalArticle","2010","Ivan Fléchais; Ivan Flechais; Shamal Faily; Shamal Faily","Towards Tool-Support for Usable Secure Requirements Engineering with CAIRIS","International Journal of Secure Software Engineering","","","10.4018/jsse.2010070104","","Understanding how to better elicit, specify, and manage requirements for secure and usable software systems is a key challenge in security software engineering, however, there lacks tool-support for specifying and managing the voluminous amounts of data the associated analysis yields. Without these tools, the subjectivity of analysis may increase as design activities progress. This paper describes CAIRIS Computer Aided Integration of Requirements and Information Security, a step toward tool-support for usable secure requirements engineering. CAIRIS not only manages the elements associated with task, requirements, and risk analysis, it also supports subsequent analysis using novel approaches for analysing and visualising security and usability. The authors illustrate an application of CAIRIS by describing how it was used to support requirements analysis in a critical infrastructure case study.","2010","2025-04-16 12:38:38","2025-04-16 12:38:38","","","","","","","International Journal of Secure Software Engineering","","","","","","","","","","","","","","","","","","https://doi.org/10.4018/jsse.2010070104","","","","","","","","","","","","","","","","","","","","","","","","","","","","","","","","","","","","","","","","","","","","","","","",""
"BAUM5JF7","journalArticle","2002","Ambrosio Toval; Ambrosio Toval; Ángel Prior Olmos; A. Olmos; Mario Piattini; Mario Piattini","Legal requirements reuse: a critical success factor for requirements quality and personal data protection","","","","10.1109/icre.2002.1048511","","Information technology misuse has increased the vulnerability of personal data, which has lead to growing concern about issues of personal privacy among political leaders, IT managers, information security consultants and the millions of people currently online. Many countries have developed, or are preparing, laws and regulations to combat the related threats and to guarantee personal data protection. Despite efforts to construct secure systems, few papers have, as yet, focused on security from the very outset of the system development life-cycle. This paper presents a pragmatic proposal to incorporate the legal and regulatory measures to guarantee personal data protection as a part of the requirements engineering process, instead of an addendum to system deployment. The authors investigate how recent efforts in the requirements engineering field can contribute to improving security issues in information systems, in particular those dealing with personal data. A reusable collection of security requirements and, as a novelty, personal data protection requirements (including information on related software components links) are provided. The pre-defined requirements, together with a simple process model based on requirements reuse, provide a strategy that organizations can use to become privacy-compliant.","2002","2025-04-16 12:38:38","2025-04-16 12:38:38","","","","","","","","","","","","","","","","","","","","","","","","","https://doi.org/10.1109/icre.2002.1048511","","","","","","","","","","","","","","","","","","","","","","","","","","","","","","","","","","","","","","","","","","","","","","","",""
"2E92B6QR","journalArticle","2001","Erik Kamsties; Erik Kamsties; Daniel M. Berry; Daniel M. Berry; Barbara Paech; Barbara Paech","Detecting Ambiguities in Requirements Documents Using Inspections","","","","","","Natural language is the most used representation for stating requirements on computer-based systems in industry. However, natural language is inherently ambiguous. Customers and software developers can disagree on the interpretation of a requirement without being aware of this fact. This disagreement can result in disastrous software failures. We argue that ambiguity is a more complex phenomenon than is often recognized in the literature. While inconsistencies and some types of incompleteness can be mechanically detected in formal specifications, ambiguities in informal specicifications often result in incorrect formal specifications. These misinterpretations can be detected only by execution or inspection of the formal specification. We suggest an inspection technique for detecting ambiguities in informal requirement documents before formal specifications are produced in order to avoid misinterpretations, rather than searching for them afterwards. We show how this technique can be tailored to different project contexts with the help of metamodels to increase its effectiveness. Finally, we report on experimental validation of the technique.","2001","2025-04-16 12:38:38","2025-04-16 12:38:38","","","","","","","","","","","","","","","","","","","","","","","","","https://scholar.google.com/scholar?q=Detecting%20Ambiguities%20in%20Requirements%20Documents%20Using%20Inspections","","","","","","","","","","","","","","","","","","","","","","","","","","","","","","","","","","","","","","","","","","","","","","","",""
"WWHLSCMG","journalArticle","2001","Annie I. Antón; Annie I. Antón; Julia B. Earp; Julia B. Earp; Colin Potts; Colin Potts; Thomas A. Alspaugh; Thomas A. Alspaugh","The role of policy and stakeholder privacy values in requirements engineering","Requirements Engineering","","","10.1109/isre.2001.948553","","Diverse uses of information technology (IT) in organizations affect privacy. Developers of electronic commerce, database management, security mechanisms, telecommunication and collaborative systems should be aware of these effects and acknowledge the need for early privacy planning during the requirements definition activity. Public concerns about the collection of personal information by consumer-based Web sites have led most organizations running such sites to establish and publish privacy policies. However, these policies often fail to align with prevalent societal values on one hand and the operational functioning of Web-based applications on the other. Assuming that such misalignments stem from imperfect appreciation of consequences and not an intent to deceive, we discuss concepts, tools and techniques to help requirements engineers and IT policy makers bring policies and system requirements into better alignment. Our objective is to encourage RE researchers and practitioners to adopt a more holistic view of application and system specification, in which a system or application is seen as an engine of policy enforcement and values attainment.","2001","2025-04-16 12:38:39","2025-04-16 12:38:39","","","","","","","Requirements Engineering","","","","","","","","","","","","","","","","","","https://doi.org/10.1109/isre.2001.948553","","","","","","","","","","","","","","","","","","","","","","","","","","","","","","","","","","","","","","","","","","","","","","","",""
"ACFCNGNW","journalArticle","2011","Shamal Faily; Shamal Faily","Bridging User−Centered Design and Requirements Engineering with GRL and Persona Cases","","","","","","Despite the large body of i* research, there has been com- paratively little work on how goal-modelling techniques can help identify usability concerns. Recent work has considered how goal models might better integrate with User-Centered Design. This paper takes an alterna- tive perspective by examining how work in User-Centered Design, specifi- cally Persona Cases, can be re-framed as goal models. We briefly describe an approach for doing  this,  and present  some preliminary results  from applying this approach using the Goal-oriented Requirements Language and existing tool support.","2011","2025-04-16 12:38:39","2025-04-16 12:38:39","","","","","","","","","","","","","","","","","","","","","","","","","https://scholar.google.com/scholar?q=Bridging%20User%E2%88%92Centered%20Design%20and%20Requirements%20Engineering%20with%20GRL%20and%20Persona%20Cases","","","","","","","","","","","","","","","","","","","","","","","","","","","","","","","","","","","","","","","","","","","","","","","",""
"TLN8TUH5","journalArticle","2011","Scott Munro; Scott Munro; Sotirios Liaskos; Sotirios Liaskos; Jorge Aranda; Jorge Aranda","The mysteries of goal decomposition","","","","","","Goal decomposition structures lie at the heart of goal model- ing languages such as i* . High-level goals of stakeholders are recursively decomposed into lower level ones and eventually into leaf level tasks to be performed by agents. The decomposition structure can also develop through a bottom up approach whereby higher-level goals are introduced as justifications for existing low-level ones. The very concept of decom- position, however, both as process and as artefact is rarely questioned in requirements engineering. In this paper, we argue that it may be of value to give a closer look into goal decomposition and clarify what we actually know about it and what is yet to be understood. We report on an on-going effort to identify empirical work on decomposition coming from various research fields, hoping to find such evidence. We then pose some research questions that we believe need to be pursued in order to improve our understanding of goal decomposition.","2011","2025-04-16 12:38:40","2025-04-16 12:38:40","","","","","","","","","","","","","","","","","","","","","","","","","https://scholar.google.com/scholar?q=The%20mysteries%20of%20goal%20decomposition","","","","","","","","","","","","","","","","","","","","","","","","","","","","","","","","","","","","","","","","","","","","","","","",""
"W8A869L2","journalArticle","2013","Daniel Amyot; Daniel Amyot; Rouzbahan Rashidi-Tabrizi; Rouzbahan Rashidi-Tabrizi; Gunter Mussbacher; Gunter Mussbacher; Jason Kealey; Jason Kealey; Etienne Tremblay; Etienne Tremblay; Jennifer Horkoff; Jennifer Horkoff","Improved GRL Modeling and Analysis with jUCMNav 5","","","","","","jUCMNav is an open-source Eclipse tool for modeling and analyzing stakeholder goals, scenarios, and requirements with the User Requirements No- tation (URN) standard. This paper gives a brief overview of this tool, with an emphasis on recent improvements targeting URN's Goal-oriented Requirement Language (GRL) found in version 5.x.","2013","2025-04-16 12:38:40","2025-04-16 12:38:40","","","","","","","","","","","","","","","","","","","","","","","","","https://scholar.google.com/scholar?q=Improved%20GRL%20Modeling%20and%20Analysis%20with%20jUCMNav%205","","","","","","","","","","","","","","","","","","","","","","","","","","","","","","","","","","","","","","","","","","","","","","","",""
"97FRB5AB","journalArticle","2011","Gunter Mussbacher; Gunter Mussbacher; Daniel Amyot; Daniel Amyot; Patrick Heymans; Patrick Heymans","Eight Deadly Sins of GRL.","","","","","","","2011","2025-04-16 12:38:40","2025-04-16 12:38:40","","","","","","","","","","","","","","","","","","","","","","","","","https://scholar.google.com/scholar?q=Eight%20Deadly%20Sins%20of%20GRL.","","","","","","","","","","","","","","","","","","","","","","","","","","","","","","","","","","","","","","","","","","","","","","","",""
"RHBQ5387","journalArticle","2007","Jean-François Roy; Jean-Francois Roy","Requirement engineering with URN: Integrating goals and scenarios","","","","10.20381/ruor-18978","","","2007","2025-04-16 12:38:40","2025-04-16 12:38:40","","","","","","","","","","","","","","","","","","","","","","","","","https://doi.org/10.20381/ruor-18978","","","","","","","","","","","","","","","","","","","","","","","","","","","","","","","","","","","","","","","","","","","","","","","",""
"JSIRZWLF","journalArticle","2005","Marco Casassa Mont; Marco Casassa Mont; Robert Thyne; Robert Thyne; Pete Bramhall; Pete Bramhall; Kwok-Nga Chan; Kwok-Nga Chan","Privacy Policy Enforcement in Enterprises: Addressing Regulatory Compliance and Governance Needs","","","","10.1007/978-3-322-85237-3_14","","","2005","2025-04-16 12:38:40","2025-04-16 12:38:40","","","","","","","","","","","","","","","","","","","","","","","","","https://doi.org/10.1007/978-3-322-85237-3_14","","","","","","","","","","","","","","","","","","","","","","","","","","","","","","","","","","","","","","","","","","","","","","","",""
"Y8IJWFPW","journalArticle","2002","Alexander Boer; Alexander Boer; Rinke Hoekstra; Rinke Hoekstra; Radboud Winkels; Radboud Winkels; Tom van Engers; T.M. van Engers","METAlex: Legislation in XML","","","","","","","2002","2025-04-16 12:38:41","2025-04-16 12:38:41","","","","","","","","","","","","","","","","","","","","","","","","","https://scholar.google.com/scholar?q=METAlex:%20Legislation%20in%20XML","","","","","","","","","","","","","","","","","","","","","","","","","","","","","","","","","","","","","","","","","","","","","","","",""
"ATAQKRPD","journalArticle","","Layman E. Allen; Layman E. Allen","Symbolic Logic: A Razor-Edged Tool for Drafting and Interpreting Legal Documents","Yale Law Journal","","","10.2307/794073","","","///","2025-04-16 12:38:44","2025-04-16 12:38:44","","","","","","","Yale Law Journal","","","","","","","","","","","","","","","","","","https://doi.org/10.2307/794073","","","","","","","","","","","","","","","","","","","","","","","","","","","","","","","","","","","","","","","","","","","","","","","",""
